,name,type,description
105,Richard Mukurumbira,annotation,"There are some good ideas in the flip lecture as it enables students to prepare in advanceThe students must provide feedback meaning not only to they have to think through the context of the videos but also apply the concept  in own setting so that they apply the concept to their own lives.I am curious about the the concept in its application, but have reservations about the fact that preparation in advance is not necessarily the be end of teaching."
106,Richard Mukurumbira,comment,"Interest concept.  Flip classes does impose a learning expectation on students.  I like the fact that the student is more likely than not to actually think through in earnest the learning outcomes, activity and resources provided in order to account to the rest of the class."
107,Mel Chavez,annotation,Two efficiencies for lecturer
108,Mel Chavez,annotation,Students are able to publish their own critical and creative thought productsStudents are able to review the videos and improve their performance skillsStudents are able to develop more high quality relationships with their lecturer
109,Mel Chavez,annotation,Needed to employ a Flipped Classroom model to increase more active participation by encouraging more creative and critical thought and make the large class room experience more engaging.
110,Till Boecking,annotation,I hope this person slows down when teaching
111,Till Boecking,annotation,"It would be cahllenging to cover the same amount of material of a substantially shorter period of time. Maybe this goes back to the topic of last video: Choosing the right content and encouraging deep learning, i.e. even though there is less content the students may end up learning more becasue they do not just absorb facts but engage with the material and think it through."
112,Till Boecking,annotation,"I consider this to be an advantage. Thinking back to my own student days, I was often missing parts of the lecture while trying to take notes of what had just been conveyed previously. Having some time to hit the pause button to review the material in ones head before continuing is useful. Similar to the experience with this annotation tool."
113,Till Boecking,annotation,"There are two potential pitfalls with this:(1) Technology needs to work flawlessly, otherwise too much time is wasted on trying to troubleshoot.(2) Not everybody likes to be recorded. Maybe this has changed to some extent in the current social media landscape where people are open to sharing their thoughts and ideas but there are certainly people who would not be comfortable to participate in this type of activity."
114,Till Boecking,comment,"Pros: - Ability to review content (also given by recording ""traditional"" lectures).- Facilitate student engagement with the material (deep learning) rather than absorbing facts (surface learning)- Encourage lecture attendanceCons:- Discourages people who do not like to be recorded- Difficult to facilitate to keep students engaged with the content rather than chatting about other things- Challenging to convey the same amount of material with a reduced lecture time (video)- High demands on the time of the academic prior and post class to manage the activities and record content"
115,Corey Martin,annotation,The purpose of using the flipped method of teaching was to increase critical creative thought and to make large classes more engaging.
116,Corey Martin,annotation,Main lecture content is video'ed and 1) reduces content delivery time from 50mins to around 12-24mins2) Students can review material to suit their pace.
117,Corey Martin,annotation,I like the idea of planning in specific time for student questions as part of the lecture. However for a large class this may not be so efficient as there is still only 1 lecturer to answer the questions.
118,Corey Martin,comment,"The ""flipped classroom"" methodology seems to have merit in some courses and maybe not so much in others.There is an assumption that students have access to available infrastructure like ""internet"" to watch the videos and that they have done the pre-work.I note that the presenter says that this type of method is targeted at engaging larger classes, however the basic items like the actual lecture theatre (layout &amp; seating) is unlikely to be suited to the type of activities that he is proposing (e.g. group work) as my experience is that students find it very difficult to engage with others in teams greater than 2 students just to the physical constraints.There is also now pressure on the lecturer to both provide a professional looking video to students (as the one shown in this video was poor) as well as not to become lazy in recording the video once with outdated information, so additional time (as a lot of effort can be spent in what is known as post-production) to do this task needs to be considered as well as the skills needed to deliver this correctly.My last comment is around the emphasis that is put on the students learning from each other and the risk that they may tend to drift off topic as well as use their limited knowledge in an area to make conclusions and potentially treat their experiences as being the expert knowledge rather than researching others work in the area."
119,Rose Butler,annotation,"It also requires students take more responsibility for their learning, which is a plus, but for some this would take some time to learn and improve - depending on their high school educational experiences/histories. I do like though how it caters to people's different learning paces/strengths/weaknesses in terms of how quickly they take up concepts based on previous knowledge. It also means they could come to class with questions formulated rather than emailing after the lecture. We are teaching in 3 hour blocks with no tutorials, which is a great model and would adapt will with this."
120,Rose Butler,comment,This model would work well in our current social impact course which is a 3 hour seminar and based strongly around team work (as well as individual assessments outside the classroom).
121,Kyllie Cripps,annotation,What about those students who are put off by the video recording?
122,Kyllie Cripps,annotation,I wonder whether it increases/decreases student attendance providing the lecture beforehand?
123,Arash Khatamianfar,annotation,"In engineering, I have noticed that even with traditionally classroom-focused learning, students often tend to skip classes and just study lecture notes at home."
124,Arash Khatamianfar,annotation,"I agree with the fact that this method can save time for both students and lecturer, particularly the pace of getting and presenting the materials via video, but it may depend on course outline and whether the intention is to add more topics in one session or just to spend more time on practicing what is given in the video."
125,Jessica Bellamy,annotation,Whilst the flipped classroom design is great for your proactive and engaged students who will pre-read the lecture conent and engage is classroom activities - I believe the continually recording and posting on the web for everyone available - gives those students who don't engage 'an easy way out'
126,Arash Khatamianfar,comment,"I feel that there are great potentials in flipped classrooms, but I believe it should be tailored based on the discipline and the course so that it can be more productive and encouraging for students to engage in class activities. One example is that the basic background can be reviewed in the pre-recorded video and then in the class students could better follow new materials rather than losing focus due to lack of background knowledge, and also tutorial classes can also be combined in some form of flipped classroom."
127,Jessica Bellamy,comment,1. FC = works well for large engaged classes2. The 'ideal' students carry the 'survivors' through the course3. Builds rapport between teacher and student4. Can the material really be covered in 15-25mins?4. No opportunity for students to ask questions whilst going through the material? Might be more difficult to understand the concepts if you have to wait until the interactive classroom
128,Abrar Chughtai,annotation,watch video before class
129,Abrar Chughtai,annotation,Lectures are cut down
130,Abrar Chughtai,annotation,Group exercises
131,Abrar Chughtai,annotation,Presentations
132,Abrar Chughtai,comment,"This method is definitely useful but I think may not be applied in all situations. Would be very difficult to manage in cases of large classroom setting, like this. Moreover the teaching curriculum and nature subject also matters.For example this might not be helpful in case of bio statistics."
