,description,duration,name,status
0,"<p>Dear All,</p> <p>Digital October is organizing a free event called Data Science week. It will take place from 24th to 30th of August in Moscow, at Bersenevskaya Nab. 6</p> <p>In order to attend you have to register at the site:</p> <p><a href=""http://digitaloctober.ru/ru/events/data_science_week_2015""><a href=""http://digitaloctober.ru/ru/events/data_science_week_2015"" class=""linkified"">http://digitaloctober.ru/ru/events/data_science_week_2015</a></a></p> <p>On 28th, the whole day will be dedicated to Apache Spark.</p> <p>Agenda for my presentation will be as following:</p> <p><b>Apache Spark development vector</b> <br/>                Brief overview of the new functionality recently added to Apache Spark.<br/>                Version 1.4 - SparkR, new interface for job monitoring and visualization, ML pipelines<br/>                Version 1.5  - Project Tungsteen, improvements in DataFrame API, imprpovements in Catalyst (SQL Optimizer), new Machine Learning algorithms, Spark Streaming. </p> <p><br/>Whoever is interested in my presentations or in any of the other presentations planned for the week are welcome to register and attend. </p> <p>Дорогие участники!</p> <p>Цифровой Октябрь организует бесплатное мероприятие под названием ""Data Science Week"", которое пройдет с 24го по 30е Августа с 18-00</p> <p>Чтобы поучавствовать, нужно зарегистрироваться на сайте мероприятия:</p> <p><a href=""http://digitaloctober.ru/ru/events/data_science_week_2015""><a href=""http://digitaloctober.ru/ru/events/data_science_week_2015"" class=""linkified"">http://digitaloctober.ru/ru/events/data_science_week_2015</a></a> </p> <p>28го Августа весь вечер будет посвящен Apache Spark. </p> <p>Краткое содержание моего выступления 28го:</p> <p><b>Apache Spark - направление развития.</b><br/>Краткий обзор функционала и новых возможностей Apache Spark.<br/>                Версия 1.4 - SparkR, новый интерфейс визуализации и мониторинга, ML pipelines<br/>                Версия 1.5  - Project Tungsteen, улучшения в DataFrame API, улучшения в Catalyst (SQL Optimizer), новые алгоритмы машинного обучения, Spark Streaming. </p> <p><br/>Все, кого может заинтересовать мое выступление, или выступления других спикеров, приглашены зарегистрироваться и посетить мероприятие.</p> ",,Digital October Data Science week,past
1,"<p><i><b>THIS MEETUP AND LIVE STREAMING IS US PACIFIC STANDARD TIME (PST). PLEASE CONVERT TO YOUR TIME ZONE.</b></i></p> <p>On June 6, 2016, leading minds in data and analytics from Tesla, Netflix, Silicon Valley Data Science, and IBM will come together to demonstrate how open data and analytics technologies such as R, Spark, Python and more are forming a vibrant ecosystem.  The community has a shared goal of working with all data to build unexpected insights and launch new business applications.</p> <p>The Apache Spark Maker Community Event will bring together data scientists, data engineers, data developers, and data designers June 6th @ 6pm at Galvanize, San Francisco. Here’s the plan:   </p> <p>- The Big Reveal – New sample Apache Spark apps and tools</p> <p>- Use Cases – Monsanto will share how they are using R and Spark to optimize their supply chain</p> <p>- Learning Session - Hear from experts working on Spark projects and building the Spark ecosystem of open data and analytics technologies</p> <p>- Networking Opportunity – Food, drinks and data, explore a Hall of Innovation showcasing Spark demos</p> <p>Join us. Learn more here: </p> <p><b><i><a href=""http://www.ibm.com/analytics/us/en/events/apache-spark/"">Apache Spark Maker Community Event</a></i></b> </p> <p>We realize you may not be able to attend in person, however, we are <b>live streaming</b> the event.  Register for the <b><a href=""https://www.eventbrite.com/e/livestream-apache-sparktm-maker-community-event-registration-24790223225?cm_mc_uid=39680333471514613509392&amp;cm_mc_sid_50200000=1461961944"">live stream</a></b> and we'll send you a calendar update and login link.</p> ",14400000.0,Apache Spark Maker Community Event,past
2,"<p>On September 27, 2016, leading minds in data and analytics will come together and unveil the latest in cloud technology, enabling you to more efficiently put data to work. Experience how Spark, Hadoop, Python, and more are being used to bring together all types of data professionals –from data engineers, to data scientists, developers and business analysts –to work in new collaborative ways.</p> <p>The IBM DataFirst Launch Event will unite data and analytics leaders and practitioners from the open source community, startups, and enterprises. Check the <i><b><a href=""http://www.ibm.com/analytics/us/en/events/datafirst/index.html"">event site</a></b></i> for the latest lineup of guest speakers. The event takes place @ 6pm at the Hudson Mercantile Building, NYC.</p> <p>Here’s the plan:<br/>• The Big Reveal –Experience new ways to work for data engineers, data scientist, developers, and business analysts, both individually and collectively.</p> <p>•Hands-on sessions – With interactive experiences for each of these professions.</p> <p>•Use Cases –Community leaders and guest speakers will share their expertise and vision<br/>•Networking Opportunity – Food, drinks, data, collaborative demos, and a party on the rooftop</p> <p>Learn more here:<a href=""http://www.ibm.com/analytics/us/en/events/datafirst/index.html#"">  <i><b>DataFirst Launch Event</b></i></a></p> <p>Check-in and networking begins at 6:00 PM.  Food and drinks will be served. You must register for this event.</p> <p>To get your ticket, and attend in person, click <b><a href=""https://www.eventbrite.com/e/ibm-datafirst-launch-event-registration-26725283041"">HERE</a></b>.  </p> <p>Can't attend in person? We'll be live streaming this event.  Register for the <b><a href=""https://www.eventbrite.com/e/livestream-ibm-datafirst-launch-event-registration-26906650516"">LIVE STREAM </a></b>and we'll send you a calendar update and login link. </p> ",14400000.0,DataFirst Launch Event – Experience new ways to put your data to work,past
3,"<p>Join The Brussels Data Science Community, <a href=""https://spark-summit.org/eu-2016/"">Spark Summit Europe</a> attendees, and Spark ML and machine learning experts Nick Pentreath and Jean-Francois Puget for a talk on an Apache Spark–based, end-to-end machine learning system. A round of Spark and machine learning lightning talks will follow.</p> <p>Many resources are available for building basic recommendation models using Spark. But how does a practitioner go from the basics to creating an end-to-end machine learning system, including deployment and management of models for real-time serving? In this session, we’ll demonstrate how to build such a system based on Spark ML and Elasticsearch. In particular, we’ll focus on how to go from data ingestion to model training to a real-time predictive system.</p> <p><b>Agenda</b></p> <p>18:30 – Welcome, food and drink</p> <p>18:40 – Update on the preparation and workshops of the <a href=""http://www.denguehack.org/"">Data4Good Hackathon</a>, and <a href=""https://datasciencebe.com/tag/philippe-van-impe/"">Philippe Van Impe</a>, founder, European Data Innovation Hub and the Brussels Data Science Community</p> <p>18:50 – Introduction: <a href=""https://spark-summit.org/eu-2016/speakers/berni-schiefer/"">Berni Schiefer</a>, IBM Fellow</p> <p>19:00 – Creating an end-to-end Recommender System with Spark ML: <a href=""https://spark-summit.org/eu-2016/speakers/nick-pentreath/"">Nick Pentreath</a>, principal engineer at the IBM Spark Technology Center, Apache Spark PMC member and author of Machine Learning with Spark, and <a href=""https://www.linkedin.com/in/jfpuget"">Jean-François Puget</a>, distinguished engineer at IBM and chief architect for IBM Analytics Solutions.</p> <p>19:45 – Lightning talks: 10 minute Spark and machine learning discussions, including new projects from Belgium. Details are coming soon. </p> <p>20:45 – Networking and refreshments</p> <p><b>PARKING - at GRAND PLACE</b><br/>Rue Marché aux Herbes 104, 1000 Brussels<br/>Boulevard de l'Impératrice - Keizerinlaan Brussels</p> ",9000000.0,Spark and Machine Learning,past
4,"<p>The demand for machine learning is booming! </p> <p>Calling all IT executives, data scientists, Chief Data Officers, data architects and other data geeks.  Join us on <b>February 15th from 2:00-5:30 pm ET </b>via livestream  (replay available starting February 16th) , and discover how machine learning is fundamentally changing the way we work and live.  Hear about cognitive applications that anticipate behavior and learn from data without being explicitly programmed.</p> <p>You'll learn about the latest breakthrough developments on machine learning as well as Spark, data and analytics. Mike Gualtieri, Vice President and Principal Analyst, Forrester, will present his view on how to best leverage technologies such as big data, predictive analytics, Hadoop/Spark, machine learning, data science, and AI.  Rob Thomas, General Manager, IBM Analytics will host an agenda which will include guest speakers and cover the following topics:</p> <p>•  Machine Learning Overview</p> <p>•  Top Trends in Machine Learning &amp; Cognitive Applications</p> <p>•  Cognitive Analytics and Machine Learning for the Enterprise</p> <p>•  Live Product Demonstration &amp; Client Roundtable on Machine Learning</p> <p>•  Data Innovation with Hybrid Transaction/Analytical Processing</p> <p>•  Spark &amp; Machine Learning for Enterprise Systems</p> <p>For additional details and to REGISTER, please visit <i><b><a href=""http://www.ibm.com/analytics/us/en/events/machine-learning/"">MACHINE LEARNING.</a></b></i></p> <p>Register NOW and we'll send you a reminder!</p> ",12600000.0,Machine Learning Launch,past
