,address,description,type
20,188 Ballarat Road Creswick VIC 3363,"Opportunity Knocks In Creswick
Here is an opportunity to snap up one of two residential allotments in a popular location of beautiful Creswick. Sitting side by side and predominantly popular for families who commute through to Ballarat, this flat vacant allotment should be considered for your next real estate project or construction of your dream home.
With all town services available and offering approximately 763m2 of level land, this allotment is fenced to one side and the back and is within walking distance to all the town amenities, along with a handy bus stop just over the road.
A short 15 minutes will take you through to Ballarat or to connect with the Western Freeway, while Creswick is also popular due to its proximity to Daylesford, Castlemaine or Bendigo.
A great opportunity for those looking for a lovely country atmosphere or investors with an opportunity here to construct a single build or townhouses (STCA) as an investment project. Call our agent for further details and full land measurements.",Vacant land
