,country,region,notes
179,Tonga,GS,Many queer residents of Tonga emigrate to other more tolerant countries to live a more open life.
180,Trinidad and Tobago,GS,"Trinidad and Tobago struck down its law banning same-sex sexual activities, as well as certain sexual acts regardless of the participants' genders, in 2017."
181,Tunisia,GS,Tunisian authorities sometimes use the criminalization of same-sex sexual activities to detain people based on appearance alone.
182,Turkey,GN,"Turkey is more queer-friendly than some other Middle Eastern countries, but social attitudes tend to be conservative and intolerant of same-sex relationships. "
183,Turkmenistan,GS,Turkmenistan is one of just two former members of the Soviet Union that has yet to decriminalize homosexuality.
184,Tuvalu,GS,Tuvalu's criminalization of sexual activity between men is reportedly not enforced.
185,Uganda,GS,"Before British colonialism, Ugandan society was accepting of same-sex relationships; but the British Empire's anti-gay laws were kept even after Uganda gained its independence."
186,Ukraine,GS,"Ukraine's constitution specifically defines marriage as between a man and a woman, a significant barrier to the recognition of same-sex marriages."
187,United Arab Emirates,GS,Same-sex sexual activity in the United Arab Emirates is governed under the same law as adultery and nonconsensual sex.
188,United Kingdom,GN,"In January 2017, the United Kingdom issued posthumous pardons to thousands of gay men who had been prosecuted under old anti-gay laws."
189,United States,GN,"While certain LGBTQ+ rights and protections are enacted on a federal level in the United States, some laws only exist in certain more progressive states."
190,Uruguay,GS,"Uruguay is frequently considered the most queer-friendly country in South America, called ""a model for social inclusion"" by Americas Quarterly."
191,Uzbekistan,GS,Uzbekistan is one of just two former members of the Soviet Union that has yet to decriminalize homosexuality.
192,Vanuatu,GS,Vanuatu repealed its law criminalizing same-sex sexual activity in 2007.
193,Vatican City,GN,"While Vatican City does not criminalize homosexuality, it does not allow people in same-sex relationships to act as foreign diplomats."
194,Venezuela,GS,Same-sex marriages and civil unions are specifically banned in the Venezuelan Constitution.
195,Vietnam,GS,Vietnam held its first gay pride parade in Hanoi in August 2012.
196,Yemen,GS,The death penalty for Yemen's anti-gay law is reportedly not enforced.
197,Zambia,GS,Zambia's social attitudes mirror those of fundamental Evangelical missionaries who came to the region during British colonial times.
198,Zimbabwe,GS,"Queer people in Zimbabwe face marginalization, discrimination, and conservative social attitudes."
