,description,location,address
0,"kings away canada
way shadwell well life refurbished",,"Bethnal Green, London"
1,hall via you extra,,"Battersea, London"
2,"i basis inclusive underground use
doors rail lift make
hello regents guy bar been well spanish pw
regents ham working",,"Angel, London"
3,"own space boasts regents environment speak
block including additional electric year flats
northern if overground rear town admin vat",,"Angel, London"
4,"tfl site routes delighted luxury dishwasher floor
doors currently terms out sainsbury look property",,"Seven Sisters, London"
5,painted estates may lots finchley food euston vibrant,,"Bayswater, London"
6,"lines central tenancy your bathrooms hill
length newly drawer be moving bedside shop
friendly place fulham train couples se shower high
through several popular bath move co etc maintained food",,"Heathrow, London"
7,"supermarket main your needed girls part will
renovated toilets pubs
shepherds more number",,"Angel, London"
8,"street description need cctv variety are attractions own
corner once back which site inc links",,"Elephant And Castle, London"
9,table this hot bridge currently stunning conveniently piccadilly friendly,,"West Hampstead, London"
10,"finsbury don restaurant
the newington oxford friends thank
canning toaster swimming further internet shadwell
girls house away some",,"West Hampstead, London"
11,"oak carpet universities licence
shops bedroom trendy residential style months dining professionals
during estates designed restaurant call virgin newington west",,"Wimbledon, London"
12,not market my,,"Camden, London"
13,"go sharing screen name thanks asap gbp right
my be purpose
every rates letting through
converted friends la check team table upper register",,"South Kensington, London"
14,"ilford ready national convenient marble power onto interior system
get business very speak immediately agent charges provides kilburn
both bar chiswick benefit co having",,"Battersea, London"
15,"connected description lounge would immaculate laundry routes
opportunity self condition e which zone light professional",,"Canary Wharf, London"
16,wardrobes wc pounds set glazed washing short current,,"Greenwich, London"
17,"rental river lots following cost my
include serviced freezer opportunity secure imperial non italian
if baker cleaner bedrooms white guy moments heart
apartments connected prime",,"Brixton, London"
18,"elephant follow boasting all perfect send corner
whole coming borough broadband walk ready months near present
currently move sociable king length",,"Notting Hill, London"
19,"situated one here welcome set finchley amazing is
nw in baker more hospital clean it while",,"Highbury, London"
20,right some storage public bbq bills,,"Chiswick, London"
21,"takes leading finished other over lane hesitate
contact gov services painted move decorated
gardens busy time extra do looking every
deposit pretty amenities",,"Canary Wharf, London"
22,"for located front business gym
enquiries glazing long canning master mod hammersmith
no so contract shopping ceilings hob center speed",,"Stratford, London"
23,"cons study t
mobile june too phone four nw numerous ceiling",,"Hackney, London"
24,end richmond you shared big t wonderful,,"Chelsea, London"
25,"place benefits cons friends
store museum charge dss both bridge
rental single huge lot
chest canary laundry stunning",,"Whitechapel, London"
26,"famous rear info near before
free tenants old hour not across before
m sitting standard july leyton near you seperate value",,"Canary Wharf, London"
27,"bright hoxton dss monthly sw wardrobes windows croydon jubilee
virgin fulham ideally find",,"Tower Bridge, London"
28,equipped everyone itself,,"Angel, London"
29,"bakerloo single they glazed sized fittings angel
air cupboard high
excellent fulham offer are serviced
hour universities into environment students direct gated and",,"West Hampstead, London"
30,"needs table market
follow loads x d arranged finchley white",,"Chelsea, London"
31,get food cctv comes,,"Camden Town, London"
32,"glazing d gbp lot service first sorry night size
ready town new brick gas green se
house lot down drive power during t houses high
court want seconds couples east make",,"Bethnal Green, London"
33,"days machine around floor love unfurnished see
don bed national too stepney clapham wifi
conveniently book live admin third sq",,"Tower Bridge, London"
34,"seperate flatshare able coffee everything national international advance
reply tenants two huge not",,"Chiswick, London"
35,free connection after carpet south swimming,,"Islington, London"
36,"amazing gym finished nearest
oak jubilee tower as chest public could lift within
finchley go docklands ring local trendy
built quote between benefits found suitable looking d give",,"Camden Town, London"
37,"massive per green address ec
length post central speak
move hill features leyton place broadway c big everyone",,"Whitechapel, London"
38,northern availability ec heathrow lot ensuite professionals outside,,"Kensington, London"
39,"anytime and built large such
victorian w x contract video
near trains students selection off next brand soon
supermarket superb ealing leisure",,"Whitechapel, London"
40,"diner studio during appliances offers pay
mary bush variety heath walthamstow within
guys lines from",,"Kensington, London"
41,"shared see church
of length microwave safe public direct",,"Surrey Quays, London"
42,those flatmate back brixton,,"Whitechapel, London"
43,"college from side maida someone houses high information
commute doors include
shop require viewings
diner always fridge transport",,"Bayswater, London"
44,"houses sainsbury finchley newly about ideally yourself inc quiet
those provide drive
couples numerous croydon located",,"Whitechapel, London"
45,"h tenant service agents variety purpose
patio roof north mary highbury streatham with",,"Hackney, London"
46,but size paddington wimbledon queen washing storage,,"Heathrow, London"
47,"facebook freezer above manned
guy italian message estates telephone of underground lovely sharing
carpeted opposite separate sought wandsworth excellent non screen night
housemates shopping prime sunny",,"Chiswick, London"
48,"flats total fridge included including
wandsworth where just furniture
going conveniently private tel reference highbury www",,"Tower Bridge, London"
49,"provides range visit want electricity start everyone license
tel business few power during tenants y bed landlords",,"Tower Hamlets, London"
50,currently utilities check,,"Shepherds Bush, London"
51,"only delighted july those english
closest no attractive perfect
what royal sharing moments
utilities overground museum will balham agents victorian",,"Greenwich, London"
52,"grove closest moving block ilford needs park
trains furnished complete over river restaurant
swimming safe angel with all next",,"Notting Hill, London"
53,"outside terrace parking links peaceful national lovely phone students
suite warehouse h tel oven euston open",,"Wembley, London"
54,viewings much plus total,,"Canary Wharf, London"
55,"the landlord throw supermarkets bathrooms houses
avenue laminated storage
your here village
cinema room day www fees opposite",,"Kensington, London"
56,"happy know end go phone speed pubs spec
these kensington swimming advance
name la standard",,"Islington, London"
57,"common price laminated
weekly easy re overground machine soon cost",,"Kings Cross, London"
58,fridge benefit life proximity tenant,,"Islington, London"
59,"utilities basis de take aspx massive working
needed baker rates description provided
breakfast site virtual
pay dishwasher details sharing tfl ad attractions possible give",,"Canary Wharf, London"
60,months weeks central,,"Hammersmith, London"
61,"such art chairs chiswick pictures shop shopping great
just clapham suitable comprises
more marylebone microwave
current little council shower",,"Whitechapel, London"
62,"village seven town amazing drive throw maida serviced for
sofa mb further maisonette
http metropolitan by dishwasher",,"Greenwich, London"
63,"reception ground balham comfortable pm zone address
desk kensington thames supermarket offered easy serviced when by",,"Notting Hill, London"
64,northern must don connected website use p smoking,,"Kensington, London"
65,"newly five share library included two completely a dining
seperate quay dinning own sainsbury balcony
elephant internet painted plenty when sainsbury
virgin commute immaculate miss over drawers",,"Whitechapel, London"
66,"tidy original forward
center brixton local rental liverpool video
such time while district x",,"Hackney, London"
67,"facing will laminate bermondsey converted terrace fantastic
lots call stop central power accommodation going wonderful",,"Seven Sisters, London"
68,easy t views set,,"Stratford, London"
69,"fantastic best by website route
girl fees serviced drawers opportunity asda some drawer
top decor coffee
a too victoria per recommended express",,"Brixton, London"
70,"flats streatham direct parking perfect ll website lounge supermarket
level tax out minimum south beautifully from way miles
d shopping corner reference home",,"Wimbledon, London"
71,"which kitchenette appliances
sainsbury august them you early",,"Heathrow, London"
72,south bars gov us one in bus,,"Islington, London"
73,"food most doors enquiries uk ceiling let information
first vibrant wifi must offers house june facilities art
garage utilities line years university full ham way include
travel french pool royal drawer found student porter",,"Surrey Quays, London"
74,"single years soon international highbury
terrace trendy every building secure new drawer shared zone
shop jubilee table admin depending or but all",,"Canary Wharf, London"
75,"toilet forward bars hammersmith at with
shepherds quite ceilings",,"Canary Wharf, London"
76,"cost ask september link transport croydon needs period residents
us conditioning church famous
range beds can power com less dryer split balcony
bermondsey ring w",,"Notting Hill, London"
77,"victoria sw local garden
sought gardens support window
forest pictures professional team price",,"Chiswick, London"
78,"female arrange microwave would date northern
st wireless double laminate marble share",,"Shepherds Bush, London"
79,marylebone takes want reach bbq buses our facing,,"Stratford, London"
80,"sitting freezer gbp
room third total kitchenette islington shoreditch ready
notting newington small m sitting
three mins lovely benefits camden site terms",,"Chelsea, London"
81,"d creative great beds edgware
wharf decor standard sainsbury june s
ideally local greenwich possible age august their",,"Elephant And Castle, London"
82,"outside direct super summer etc august english
seconds recommended bathrooms our street",,"South Kensington, London"
83,kitchenette parking baker connected north,,"Mile End, London"
84,"contact eat offer suitable http together july
aldgate several students kitchenette plenty delighted let road licence
unfurnished selection off any heating entry
broadway finished immediately hours drawers",,"Seven Sisters, London"
85,"hot pm suitable here late split quote washing en
w bills banks etc flat beds
bar borough appliances piece de master near comfortable always",,"Bayswater, London"
86,"male towards them before
equipped must next gbp",,"Bayswater, London"
87,rail all license gbp look white,,"Wembley, London"
88,"cafes whole open but stunning shepherds toilet
full cleaning water recommended stunning
rates car international from development
well residential set",,"Camden, London"
89,"environment chair garage thank sociable
leyton business hot
yourself close piece minimum will connections",,"Chelsea, London"
