,description,category,company
0,"<div class=""field field-name-body field-type-text-with-summary field-label-hidden""><div class=""field-items""><div class=""field-item even"">Salonist software is a smart tool for handling salon services and activities. With the help of this tool, salon owners can earn more profits and also can streamline their business operations. Its inventory management feature helps to manage the inventory of the salon products.",Software-as-a-Service,Shrivra
1,"<div class=""field field-name-body field-type-text-with-summary field-label-hidden""><div class=""field-items""><div class=""field-item even"">Talk to cute waifu on Desktop (Windows/Mac/Linux). Waifus are anime-themed personal assistants.",Artificial Intelligence,WaifuAI
2,"<div class=""field field-name-body field-type-text-with-summary field-label-hidden""><div class=""field-items""><div class=""field-item even"">Talk to cute waifu on Android. Waifus are anime-themed personal assistants.",Artificial Intelligence,WaifuAI
3,"<div class=""field field-name-body field-type-text-with-summary field-label-hidden""><div class=""field-items""><div class=""field-item even"">Gain more customers, optimize your business and earn more money - with Simply CRM.
Simply is the CRM you will actually use:
Easy-to-use - visual overviews, drag'n'drop, designed for humans, not PHD's in IT.
All-in-one platform - including CRM, Helpdesk, Financial &amp; Project Management.
Free support 24/7 - in your local language.
Making Sales Visual: Simply makes it easy to close more leads, manage your customers, and remember and prioritize you opportunities.
Support Customers: Integrated helpdesk and ticketing to followup on customer requests and get full overview.
Invoicing: Invoice customers directly from Simply, including
products, inventory &amp; recurring invoicing.
Projects: Manage projects with tasks, milestones and Gantt charts.
Try Simply for free right now, and we will help you get started!
https://simply-crm.com/try-for-free/
Question? Write us at support@simply-crm.com",B2B,Simply CRM
4,"<div class=""field field-name-body field-type-text-with-summary field-label-hidden""><div class=""field-items""><div class=""field-item even"">CareSteps – Robust, Paperless Business Solutions
it provides versatile and paperless mobile business solutions that reduce your business cost and improve online market visibility. Go paperless today!",Digital Asset Management,Scale Campaign
5,"<div class=""field field-name-body field-type-text-with-summary field-label-hidden""><div class=""field-items""><div class=""field-item even"">Are you a business owner looking to add an affiliate marketing feature to your e-commerce platform or want to start your own marketing network? Scaleo allows you to create a seamless customer experience that fits your brand perfectly. Get detailed statistics with 30+ data breakdowns and 50+ data points. Track, analyze, and optimize your campaigns in real-time, filter out fraud traffic and clicks, get automated alerts and easy affiliate payouts.",Marketing,
6,"<div class=""field field-name-body field-type-text-with-summary field-label-hidden""><div class=""field-items""><div class=""field-item even"">QuickMocker is an online API tool that allows to create your own public domain and a fake web services, intercept and debug requests in live mode, use regular expressions as URL paths and multiple HTTP methods per endpoints, prioritize endpoints. With QuickMocker you can easily integrate 3rd party reverse requests (webhooks) using Local Forwarder feature that can forward request even to your localhost URL.",Tools,
7,"<div class=""field field-name-body field-type-text-with-summary field-label-hidden""><div class=""field-items""><div class=""field-item even"">EspoCRM is an open-source web application designed to build loyal relationships with customers and boost your sales. The software creates a unified collaborative place for your employees with all the necessary data inside - customer profiles and communications with them, information about opportunities, sales orders, invoices &amp; quotes. It allows to streamline the sales processes, automate routine operations, create personalized marketing campaigns and provide top quality customer service.",Customer Relationship Management,Letrium LTD
8,"<div class=""field field-name-body field-type-text-with-summary field-label-hidden""><div class=""field-items""><div class=""field-item even"">Email2Go is an online service that helps you create email templates and test them on dozens different physical devices and applications.",Software-as-a-Service,Email2Go
9,"<div class=""field field-name-body field-type-text-with-summary field-label-hidden""><div class=""field-items""><div class=""field-item even"">The Domain Rank Checker is designed to uncover the keywords that drive most organic traffic to your website. Or you can use this tool to perform competitor research and discover what keywords your competitor is targeting and ranking for.",SEO,SEO Review Tools
10,"<div class=""field field-name-body field-type-text-with-summary field-label-hidden""><div class=""field-items""><div class=""field-item even"">Use the Core Web Vitals checker to see if your website passes the Google web vitals test including:
# Largest Contentful Paint (LCP)
# First Input Delay (FID)
# Cumulative Layout Shift (CLS)
When a page doesn't pass the Core Web Vitals test, the tool will show the issues that need to be addressed to pass the test.",SEO,SEO Review Tools
11,"<div class=""field field-name-body field-type-text-with-summary field-label-hidden""><div class=""field-items""><div class=""field-item even"">If you laid every American who died from COVID-19 in a circle around Trump Tower, this is how big it would be. This mashup uses the CoronaTracker API to visualize COVID19 data.",Coronavirus,
12,"<div class=""field field-name-body field-type-text-with-summary field-label-hidden""><div class=""field-items""><div class=""field-item even"">Treemily is an online family tree builder that helps users create diverse visualizations of their family. The platform is free for all basic functionality and family tree designs, with paid membership options available for access to more robust customization options. Users can purchase the designs as downloads or ready made prints, from posters to framed canvases. Since the tree builder templates are the key novelty of the Treemily platform, users can simply import their existing lineage as a GEDCOM file, and generate visualizations.",Genealogy,Famolive Inc
13,"<div class=""field field-name-body field-type-text-with-summary field-label-hidden""><div class=""field-items""><div class=""field-item even"">Provides an overview of travel highlights around the world using interactive maps with destinations such as cities, beaches, national parks and cultural sites.",Travel,Vacationic
14,"<div class=""field field-name-body field-type-text-with-summary field-label-hidden""><div class=""field-items""><div class=""field-item even"">CryptoCRIT is an open-source Cryptocurrency project which facilitates a Cryptocurrency wallet for making payments. The associated Cryptocurrency is called CritCoin.",Cryptocurrency,TheAbbie
15,"<div class=""field field-name-body field-type-text-with-summary field-label-hidden""><div class=""field-items""><div class=""field-item even"">PEARL is a digital trade payables automation tool that streamlines an organisation’s “Procure to Pay” business cycle resulting in tangible savings &amp; an improved partner ecosystem.",Accounting,MYND Solutions Pvt. Ltd.
16,"<div class=""field field-name-body field-type-text-with-summary field-label-hidden""><div class=""field-items""><div class=""field-item even"">A quick and simple responsive developer portfolio theme for jekyll sites and GitHub Pages.",Profiles,
17,"<div class=""field field-name-body field-type-text-with-summary field-label-hidden""><div class=""field-items""><div class=""field-item even"">The Google SEO checker helps you to find out how Google scores your on-page SEO efforts. Based on 14 key features Google will give you feedback and recommendations to improve your website for search. Some examples of the elements that are included when performing the analysis are indexation, status code, robots.txt, canonical, meta description, title tag and more..",SEO,SEO Review Tools
18,"<div class=""field field-name-body field-type-text-with-summary field-label-hidden""><div class=""field-items""><div class=""field-item even"">The Pomodizer APP was created for managing tasks and time, made in the format of a weekly planner, with a limited number of tasks and a timer, to track the time spent (Pomodoro principle).
The service was designed to maximize the user's attention on achieving short-term and long-term goals, facilitate planning, and track channels for spending working time (in the context of projects, activities, degree of productivity, etc.)",Tasks,Сoures
19,"<div class=""field field-name-body field-type-text-with-summary field-label-hidden""><div class=""field-items""><div class=""field-item even"">Nuacem is an AI-powered Omnichannel Customer Engagement Platform that offers the full features and capabilities required to build sophisticated Customer Engagement, Experience, and Support solutions built for Enterprises.",Artificial Intelligence,Nuacem AI Pvt Ltd
20,"<div class=""field field-name-body field-type-text-with-summary field-label-hidden""><div class=""field-items""><div class=""field-item even"">Mailcheap is an API-first email hosting service with a user-friendly interface. Mailcheap provides affordable scalability for small &amp; large businesses using dedicated email servers without any per-user/per-domain limits. Furthermore, the powerful API enables you to meet your changing business requirements with ease.",Email,"Cyberlabs, Inc. &amp; Cyberlabs s.r.o."
21,"<div class=""field field-name-body field-type-text-with-summary field-label-hidden""><div class=""field-items""><div class=""field-item even"">thetrendbed.com displays and keeps record of the top trending news articles, twitter trends and trending youtube videos worldwide and in various countries. It is good for analysis of trends and trend histories.",News Services,The Trend Bed
22,"<div class=""field field-name-body field-type-text-with-summary field-label-hidden""><div class=""field-items""><div class=""field-item even"">Web application provides tide prediction anywhere in the World Ocean for whole year.
User can generate Tide Chart for his/her current location or search for a place.
It is also possible to zoom-in to any minute in the Tide chart year and explore water level heights and extremes.",Weather,
23,"<div class=""field field-name-body field-type-text-with-summary field-label-hidden""><div class=""field-items""><div class=""field-item even"">Desert Safari Dubai API is providing all tour services in Dubai and its Dubai base company that offers tours services, like Desert Safari Tour, Dhow Cruise Dinner, City Tours, e.g Dubai City Tour Abu Dhabi City Tour and Sharjah Tour.",Travel,Desert Safari Dubai Pro
24,"<div class=""field field-name-body field-type-text-with-summary field-label-hidden""><div class=""field-items""><div class=""field-item even"">The free Website Traffic Estimator is designed to quickly discover how many people visit a specific website on a monthly basis. In addition this tools shows you how many pages an average user views during a single session and the average bounce rate. Research and compare your competitors to find out how many monthly visitors they attract.",SEO,SEO Review Tools
25,"<div class=""field field-name-body field-type-text-with-summary field-label-hidden""><div class=""field-items""><div class=""field-item even"">ELCIES has developed a Personalized Workouts API to accelerate digital workout and exercise platforms by integrating Personalization Algorithm into external Personal Training Platform and Apps. ELCIES is a lifestyle data platform that allows businesses to obtain and organize fitness and health data without heavy integration.",Health,ELCIES
26,"<div class=""field field-name-body field-type-text-with-summary field-label-hidden""><div class=""field-items""><div class=""field-item even"">App Store Optimization tool that gives you an opportunity to get the best visibility in App Store &amp; Google Play. Get the best tips and guides right now! Find New Keywords, Track App Rankings!",Optimization,
27,"<div class=""field field-name-body field-type-text-with-summary field-label-hidden""><div class=""field-items""><div class=""field-item even"">Praxedo is proven, cloud-based field service software, enable your dispatchers, field staff and administrators to be more productive while improving customer satisfaction.
Technicians, inspectors, auditors and drivers are always connected with Praxedo in real- time. This drives operational efficiency and optimises resource planning. Praxedo is an open platform that interfaces seamlessly with ERP, CRM and any other third-party application, using standard web services, as well as our existing connectors.",Software-as-a-Service,Praxedo 
28,"<div class=""field field-name-body field-type-text-with-summary field-label-hidden""><div class=""field-items""><div class=""field-item even"">A Cross-platform app built using Appcelerator and the OTNet.tv media API.",Media,OTNet.tv
29,"<div class=""field field-name-body field-type-text-with-summary field-label-hidden""><div class=""field-items""><div class=""field-item even"">DeployPlace is an automated deployment tool for easy deployment of complex applications to your servers or to the cloud.",DevOps,DeployPlace
30,"<div class=""field field-name-body field-type-text-with-summary field-label-hidden""><div class=""field-items""><div class=""field-item even"">Mesibo is a real-time chat app for your business or personal communication and also provides APIs that lets you build real-time chat messaging, voice, and video calls in your mobile apps and websites in just a few hours. Mesibo SDK underpins the complexities of messaging not only by providing a cross-platform API, ready to use UI but also a solid, scalable carrier-grade platform built from the ground-up to support millions of concurrent calls &amp; messaging with low latency &amp; high reliability.",Chat,mesibo
31,"<div class=""field field-name-body field-type-text-with-summary field-label-hidden""><div class=""field-items""><div class=""field-item even"">Spreadsheet fund is a Gsheet Add-On for Fund Administration - it's a Free Google Spreadsheets Add-On for investment fund management &amp; portfolio tracking. Automated Back-Office of your mutual Fund suitable for any asset's class (crypto, stock, forex, real estate, and others)
Features:
- Track portfolio of cryptocurrencies, stocks, forex or any other. asset with calculating of Net Asset Value in real-time.
- Auto-sync balances from wallets and exchanges.
- Accounting for shares of investors by the mutual unit.
- Automation of Entrance/Redeem/Transfer Fund's shares.
- Recording of fund performance and portfolio snapshots.
- Proper performance/entry/redeem fees automation.
- Telegram notifications.
- Portfolio rebalancing, reporting, assets valuation, and more...",Financial,Spreadsheet Fund
32,"<div class=""field field-name-body field-type-text-with-summary field-label-hidden""><div class=""field-items""><div class=""field-item even"">Instantly Find and Embed Videos for all the products you sell, from all the major media websites including YouTube, Facebook and Vimeo. Display embedded media as the Product Featured Video or in a custom tab. You can automate the entire process and you have detailed control over which videos show on which products. Get Started for Free!",Video,ApiGenius
33,"<div class=""field field-name-body field-type-text-with-summary field-label-hidden""><div class=""field-items""><div class=""field-item even"">Shopify app that automatically tags product images with useful tags to improve shop SEO and conversion.",eCommerce,Code Orange
34,"<div class=""field field-name-body field-type-text-with-summary field-label-hidden""><div class=""field-items""><div class=""field-item even"">Honeygain is a mobile application in which users can earn money by allowing application access to user behavior. Simply download the app, turn it on, and earn!",Monetization,Honeygain
35,"<div class=""field field-name-body field-type-text-with-summary field-label-hidden""><div class=""field-items""><div class=""field-item even"">Antideo maintains large database with spam and scam records, IP locations and infected ranges, proxy records and many more. We are keeping our database updated regularly from various sources, as well as collecting some of the data ourselves. Final result is millions of IP and email records kept up to date and free to use in a fair manner.",Spam,Bizmindz Technologies LLP
36,"<div class=""field field-name-body field-type-text-with-summary field-label-hidden""><div class=""field-items""><div class=""field-item even"">Android app which allows users to search for adoptable pets in the United States using the Petfinder API.",Animals,
37,"<div class=""field field-name-body field-type-text-with-summary field-label-hidden""><div class=""field-items""><div class=""field-item even"">The Consolidated Screening List (CSL) is a list of parties for which the United States Government maintains restrictions on certain exports, re-exports or transfers of items.",eCommerce,LandedCost.io
38,"<div class=""field field-name-body field-type-text-with-summary field-label-hidden""><div class=""field-items""><div class=""field-item even"">Here any one can develop voice apps for Amazon Echo, Google Assistant and Microsoft Cortana. We support proactive event notifications using scheduler and web hooks. Users can also develop Chatbots using NLP.",Voice,
39,"<div class=""field field-name-body field-type-text-with-summary field-label-hidden""><div class=""field-items""><div class=""field-item even"">Find great deals on a wide range of different pc game hardware, accessories and video games.",Coupons,BestGamingPC.com
40,"<div class=""field field-name-body field-type-text-with-summary field-label-hidden""><div class=""field-items""><div class=""field-item even"">The Keyword Research Tool helps you to quickly identify keyword opportunities related to your topic. In addition the Keyword Research Tool returns monthly search volume trends, organic difficulty estimates, total organic search results in Google and average cost per click (CPC) data. With this tool you’re able to discover new keywords and improve the performance of your content in search.",Content,SEO Review Tools
41,"<div class=""field field-name-body field-type-text-with-summary field-label-hidden""><div class=""field-items""><div class=""field-item even"">Standuply is #1 Project Management bot for Slack. It runs asynchronous standup meetings and team surveys via text, voice &amp; video. With flexible scheduling options, you can configure Standuply to run reports when it's convenient for your team and use your custom questions. Designed for small and large companies with multi-admin access. Integrated with: JIRA, Trello, Github, GitLab, Bitbucket, Google Analytics. Standuply is trusted by 20,000 teams from Slack, IBM, Adobe, Yelp, eBay and others.",Project Management,Standuply
42,"<div class=""field field-name-body field-type-text-with-summary field-label-hidden""><div class=""field-items""><div class=""field-item even"">LoanProfy is a service for searching and comparing loans online. With it, you can quickly pick up a microloan with the necessary amount and term of the loan.
With the help of LoanProfy, you can not only choose a suitable loan but also apply for money online, in cash or on a card. You can use the services of the service without registration. LoanProfy allows you to get a quick loan online at any time of the day and without refusal.
The service allows you to get all the information about microloans: compare interest rates, amounts, and terms; view the list of documents; to study the terms of repayment and the possibility of prolongation; Read MFI client reviews.",Financial,LoanProfy
43,"<div class=""field field-name-body field-type-text-with-summary field-label-hidden""><div class=""field-items""><div class=""field-item even"">Datantify.com allows you build a list from any industries &amp; countries with verified data from more than 187 various countries.
Datantify provides B2B databases for purchase with to help you locate new potential customers and boost your sales. Their service provides over 4000 various sort options.",Database,Datantify
44,"<div class=""field field-name-body field-type-text-with-summary field-label-hidden""><div class=""field-items""><div class=""field-item even"">Penny Parrot is an Amazon price trackef of products on Amazon. Its modern and mobile-friendly charts let you see the exact price at any moment. You can subscribe for price drop alerts via email.",eCommerce,Penny Parrot
45,"<div class=""field field-name-body field-type-text-with-summary field-label-hidden""><div class=""field-items""><div class=""field-item even"">BanksNearMe is built with Google Maps API and the Google Places API and can be integrated with Bootstrap's mobile-first framework to help you find nearby banks and ATMs based on your current location, or by custom search. BanksNearMe is a free service.",Mapping,BanksNearMe
46,"<div class=""field field-name-body field-type-text-with-summary field-label-hidden""><div class=""field-items""><div class=""field-item even"">Hashtag Suggestions allows users to find hashtags to use for each topic.
A user enters the topic in the search box, and the tool will provide a list of hashtags used with that topic. The size of hashtag indicates it's popularity.",Tweets,
47,"<div class=""field field-name-body field-type-text-with-summary field-label-hidden""><div class=""field-items""><div class=""field-item even"">Real estate search engine in Czech Republic.",Real Estate, Abago Holding
48,"<div class=""field field-name-body field-type-text-with-summary field-label-hidden""><div class=""field-items""><div class=""field-item even"">The Autochat Whatsapp API Sandbox allows you to integrate the Whatsapp API with your business for free. With the Whatsapp API Sandbox, you can take advantage of most of the functionalities of the Whatsapp API platform and build, develop and test your integration without waiting for account approval. No complex setup, waiting for approval, or need to test your integration in a live environment. Just register and your Whatsapp API Sandbox is ready to use.",Testing,Autochat
49,"<div class=""field field-name-body field-type-text-with-summary field-label-hidden""><div class=""field-items""><div class=""field-item even"">Refinansiere.net is a Norwegian portal which compares rates and terms on various refinancing offers. That includes annual percentage rates, downpayment times and various miscellaneous costs charged by each lender. Numbers are fetched through the API of Finansportalen, a portal run by the Norwegian government through which bank and finance institutions upload their data. Refinansiere.net seeks to help consumers make the right financial choice, based on their individual financial situation.",Financial,Refinansiere.net
