,rank,language,description
0,"4.6(1,527 ratings)",English,This is a Complete Massage Course That Will Teach You Everything That You Need to Know to Give Amazing Massages
1,4.7(592 ratings),English,"Gua Sha Massage-Learn how to treat your own pain, your family or your massage clients with this amazing technique !"
2,4.5(105 ratings),English,"Become a Top-Rate Pro with an International Fusion Skill Set: Hawaiian, Thai Yoga, Hot Stone, Swedish, Indian & More"
3,4.6(545 ratings),English,Start doing World Famous Thai foot reflexology massage today and people will LOVE your reflexology treatments.
4,4.6(558 ratings),English,People will LOVE your Lomi Lomi massages. Learn this World famous massage style and give people incredible massages
5,4.6(168 ratings),English,"You will be able to give people incredible chair massages effortlessly, and you do not need a massage chair (3 CEU's)"
6,4.3(225 ratings),English,Fully Accredited Course! Learn the massage techniques of Indian Head Massage to take your clients into total relaxation!
7,4.6(77 ratings),English,"Start using Kinesio tape in your massage clinic TODAY and see your massage clients get so much better, faster."
8,4.4(171 ratings),English,A comprehensive course on giving intimate (genital) touch to a woman.
9,4.6(367 ratings),English,Enhance your treatments with simple acupressure and meridian massage.
10,4.6(165 ratings),English,Learn how to use acupressure massage to become healthier by treating your own health conditions naturally!
11,4.0(162 ratings),English,Couples Massage taught by Professional Sexologist focusing on Women's body. Additional Aroma Therapy and Essential Oils
12,4.4(96 ratings),English,Massage Therapy Course 101
13,4.2(182 ratings),English,"Discover how easy massage techniques can be a path to happier relationships, better marriages and grateful friends."
14,4.3(82 ratings),English,A comprehensive course on giving intimate touch to a woman's breasts.
15,5.0(7 ratings),English,Transform your massage business by using aromatherapy essential oils and see incredible results with your clients!
16,4.4(58 ratings),English,Learn how the give your partner the best massage of their lives in the comfort of your own home
17,4.2(99 ratings),English,A comprehensive course on giving intimate (genital) touch to a man.
18,4.7(140 ratings),English,"This massage training teach how to develop the knowledge, skills and confidence to give great massage to your clients."
19,4.5(49 ratings),English,"Relaxing Massages From Around The World: Hawaiian Lomilomi, Indian Head, Hand, Abdomen & Leg Massage + a Pro 'Back Rub'."
20,4.6(42 ratings),English,"Beautiful Music, Professional Voice-Over & a Moroccan Beach. Master these Beautiful Massages, Swiftly & Smoothly."
21,4.6(43 ratings),English,"Two Pro Certificates: Narrated, Real-Time Demonstrations on the Beautiful Shores of Morocco"
22,4.2(114 ratings),English,"Give From Your Heart, Not From Your Hands"
23,4.5(85 ratings), English,Complete whole body massage course by Brian Cavill
24,3.4(35 ratings),English,Natural and Holistic Therapy for vitality and well-being
25,5.0(1 rating),English,"Low-Effort, Strain-Free, Deeply Therapeutic Techniques Designed to Destroy Tension, Save Your Energy & Avoid Fatigue"
26,4.2(9 ratings),English,You will learn how to become a successful Anti-Cellulite cupping massage therapist
27,4.2(33 ratings),English,Natural and Holistic Therapy for vitality and well-being
28,4.3(48 ratings),English,"A Quick and Gentle Way to Reduce Pain, Stiffness and Enhance Relaxation"
29,4.5(46 ratings),English,"Learn all the basic strokes, how to apply them, a complete demonstration, and comprehensive, informative hints and tips"
30,4.2(4 ratings),English,"This course will teach you to offer a professional ,Deep Tissue Massage using unique techniques with hot oil."
31,4.2(34 ratings),English,The Art of Intuitive Massage
32,5.0(1 rating),English,Postural Massage is a Unique Techinique to Relax and Cure the Posture by Acupressure.
33,4.1(4 ratings),English,Learn the massage techniques of Japanese Head Massage to take your clients into total relaxation!
34,4.1(11 ratings),English,Learn step by step how to give the Ultimate Swedish massage
35,3.5(66 ratings),English,"Improve how you feel physically, emotionally and mentally, as you relieve headaches, back pain, stress, allergies, aches"
36,4.4(42 ratings),English,Add massage technique to your practice as a professional massage therapist.
37,3.7(12 ratings),English,Improve your relationship by loving touch and take it to a totally new level!
38,4.7(12 ratings),English,Solve you physical pain with the techniques covered in this course. Start your own practise and improve your body!
39,5.0(3 ratings),English,Exclusively for trained therapists
40,3.9(15 ratings),English,Exclusively for trained therapists
41,5.0(1 rating),"English
 ","What can you do, to Brighten the Mood ˜ When your partner’s tired and achy, But your tired too?"
42,4.8(4 ratings),English,Exclusively for trained therapists
43,4.7(7 ratings),English,"​The most powerful, yet simple, fast-acting, enjoyable self-massage system for your superself in the entire universe so"
44,4.0(1 rating),English,Chinese Medicine Online Education by Wushan TCM
45,4.6(3 ratings),English,"40 Movements easy, direct and really efficient (course in Portuguese with English non-automatic subs)"
46,5.0(4 ratings),English,a Maximizing Massage Profits e-course
47,4.3(2 ratings),English,Exclusively for trained therapists
48,5.0(2 ratings),English,Exclusively for trained therapists
49,4.6(8 ratings),English,10 Minute All-In-One Head Massage with Ear Reflexology
50,4.0(31 ratings),English,How to Give a Great Remedial Treatment With Little Effort!
51,5.0(2 ratings),English,Relieve Stress and Get Your Emotions Back On Track Naturally with Chinese Acupressure Massage and Positive Self-Talk!
52,4.0(8 ratings),English,"A full course in chocotherapy massage and treatment, including a facial massage with a cocoa oil."
53,4.0(1 rating),English,Making massage a part of bedtime ritual / Step-by-step course
54,0.0(0 ratings),English,"Natural and holistic therapy for to release tension, stress and pressure"
55,4.2(300 ratings),English,Improve your physical mobility and comfort with an accessible tool
56,4.6(272 ratings),English,Pronunciation of the Major Muscles of the Body
57,4.4(431 ratings),Português,
58,4.6(73 ratings),Português,APRENDA O PASSO A PASSO DA TÉCNICA DE DRENAGEM LINFÁTICA CORPORAL DE MANEIRA SEGURA E EFICAZ.
59,3.9(38 ratings),French,"Le Massage Relaxation Détente, Vous Apprend à Pratiquer un Massage Professionnel qui se Démarque: Cours Simple et Facile"
60,4.5(25 ratings),Deutsch,Lerne HIER die Grundlagen der Fußreflexzonen-Massage. Alles wird Schritt-für-Schritt im Video erläutert!
61,4.8(52 ratings),Deutsch,Lerne HIER die Grundlagen der klassischen Ganzkörpermassage kennen. Alles wird Schritt-für-Schritt im Video erläutert!
62,4.5(24 ratings),Deutsch,"Effektive, fasziale Techniken für Schulter, Knie und HWS, eingebettet in eine bio-psychosoziale Sichtweise des Menschen"
63,4.5(11 ratings),Português,"Faça uma ""acupuntura"" com os dedos para tratar seus problemas emocionais, físicos e muito mais"
64,4.3(76 ratings),Português,"Aprenda diferentes técnicas irão superar a celulite, eliminar aspecto ondulado da epiderme, tipo casca de laranja."
65,4.7(16 ratings),Français,"Guide complet, étape par étape, pour un massage réussi"
66,4.2(33 ratings),Deutsch,"Lerne HIER die Grundlagen der präventiven, manuellen Lymphdrainage. Alles wird Schritt-für-Schritt im Video erläutert!"
67,4.4(7 ratings),Deutsch,Lerne HIER die Grundlagen der Breuß Massage. Alles wird Schritt-für-Schritt im Video erläutert!
68,4.9(3 ratings),Polski,Kurs uzdrawiania i znajomości obszaru brzucha oraz pępka. Uzdrawianie holistyczne.
69,4.5(15 ratings),Español,Amor para tu cuerpo y mente en un masaje
70,4.4(23 ratings),Español,TRABAJO DEL TEJIDO BLANDO ( MÓDULO 2 )
71,3.9(10 ratings),Español,Aprende a Dar tus primeros masajes... sumergite en este maravilloso arte!
72,4.4(9 ratings),Deutsch,"Lindern Sie selbst Kopf- und Rückenschmerzen, Allergie, Notfälle und mehr mit besten professionellen Akupressurvideos."
73,3.8(45 ratings),Spanish,"Aprende la arte del Shiatsu y ayuda a tu familia a estar mejor, Massage course"
74,4.1(14 ratings),Deutsch,Lerne HIER die Grundlagen der Shiatsu Massage. Alles wird Schritt-für-Schritt im Video erläutert!
75,4.5(61 ratings),Русский,Быстродейственная методика естественного самоомоложения и фитнеса лица
76,4.8(4 ratings),日本語,家庭で効果的なマッサージをする為に必要最低限の知識、技術をまとめた講座です
77,4.8(4 ratings),Español,"Un increíble masaje que podrás ofrecer a tu bebé, tu pareja o tus padres... con increíbles beneficios!!"
78,4.3(8 ratings),Português,Relaxamento Muscular - Massagem Relaxante
79,4.0(12 ratings),Simplified Chinese,随时随地，轻松学习中医小儿推拿，保健按摩及疾病康复治疗 - 腹痛、厌食、湿疹、不睡觉。 . Learn professional pediatric massage at your own pace.
80,3.0(4 ratings),Spanish,"Alivie usted mismo la ansiedad, la migraña, enfermedades de la mujer y mucho más con los mejores vídeos de acupresión."
81,4.4(15 ratings),Français,Technique et Anatomie Pratique
82,3.8(3 ratings),Deutsch,Lerne HIER die Grundlagen der Baby-Massage. Alles wird Schritt-für-Schritt im Video erläutert!
83,4.9(13 ratings),Русский,Быстрая и эффективная помощь вашей семье и друзьям
84,4.8(6 ratings),Deutsch,Lerne HIER die Grundlagen der Hot-Stone-Massage. Alles wird Schritt-für-Schritt im Video erläutert!
85,5.0(1 rating),Deutsch,Lerne HIER die Grundlagen der Kräuterstempel Massage. Alles wird Schritt-für-Schritt im Video erläutert!
86,3.8(10 ratings),한국어,마사지라이센스 시험 대비를 위한 연습문제
87,0.0(0 ratings),Deutsch,"Lindern Sie selbst Kopfschmerzen, Grippe, Allergie, Notfälle & vieles mehr mit besten professionellen Akupressurvideos!"
88,4.4(3 ratings),한국어,마사지라이센스 시험 대비를 위한 연습문제
89,0.0(0 ratings),Deutsch,Ganzkörperbehandlung und Kosmetische Behandlung am Gesicht
90,2.5(2 ratings),Polski,Pomagaj sobie i bliskim! Techniki masażu od Kostoprawów i Masażystów starej szkoły.
91,2.5(6 ratings),Türkçe,Masaj Dersleri
92,4.1(3 ratings),Русский,"Масссаж - как искусство, каждый в нем может достичь мастерства и дарить свои умения окружающим!"
93,5.0(2 ratings),한국어,마사지라이센스 시험 대비를 위한 연습문제
94,5.0(1 rating),Deutsch,Lerne HIER die Grundlagen der Gua-Sha-Massage. Alles wird Schritt-für-Schritt im Video erläutert!
95,4.5(4 ratings),한국어,마사지라이센스 시험 대비를 위한 연습문제
96,4.3(5 ratings),한국어,마사지라이센스 시험 대비를 위한 연습문제
97,4.7(4 ratings),日本語,30分で覚える一生使える技術。指圧のセルフケアで目の疲れ解消法を身に着けよう！
98,0.0(0 ratings),Deutsch,Willkommen bei einer etwas anderen Art der Massage!
99,3.5(1 rating),Deutsch,"Massage an den Füßen, analog zur Wirbelsäulenzone und am Zeitgefüge. Mehr Balance durch pränatale Arbeit"
100,0.5(1 rating),Deutsch,"Lindern Sie selbst Depression und Asthma, verbessern Sie Gedächtnis, Yoga, Potenz & mehr mit den besten Akupressurvideos"
101,3.4(5 ratings),日本語,めまい、頭痛、動悸、不安感などの自律神経の不調の症状をソフトな施術で改善します。誰でも簡単に習得できるので、強い力が苦手な女性セラピストさんに大好評のセラピーです。
102,5.0(1 rating),Русский,Целительные касания своими руками. 100% наука и удовольствие
103,3.4(2 ratings),日本語,頭から足までのマッサージの仕方とストレッチの仕方をくまなくお伝えします。治療講座４部作その２。
104,3.4(6 ratings),日本語,手数を少なくし、持続を使い圧を最大限に引き出すマッサージ技法。手数が少ない分ポイントの精度が高い。整体師やセラピストに人気があり大手サロンの店長クラスも受講。開業サポート体制あり。同技術で14店舗が開店、現在も増殖中。
105,0.0(0 ratings),Français,Devenir masseur/masseuse. Un mélange de massage californien et massage suédois. Apprendre à masser comme un PRO!
106,0.0(0 ratings),Русский,Эзотерический массаж курс
107,4.6(526 ratings),Spanish,Aprende desde cero Masaje antiestres y relajante. conoce el maravilloso mundo de las terapias alternativas y preventivas
108,4.7(5 ratings),日本語,瞬間治療講座4部作その１
