,organisation,description,address
0,Maggin Development Consultancy Group,"MDCG was founded by a group of 13 like-minded individuals who share common vision and aspirations for a peaceful and modern Myanmar. The renewed fighting in Kachin State in 2011/2012 and the slow response by the international community brought the group – back then many of them were simply private donors – together in an effort to join forces to alleviate the suffering caused to the thousands of innocent civilians affected by the conflict.The diverse background and wide-range of technical expertise of the core group has provided MDCG with a unique multi-ethnic and multi-sectoral make-up and a sound programming foundation. Most members of the founding group and the current staff have years of experience working in humanitarian and development programs in rural Myanmar at grass-roots level. Their work and program conception are guided by humanitarian principles, rights based approach, international norms and standards, and well adapted to local context and culture. MDCG staff comprises of a well-balanced pool of experienced social workers with community development experiences from several years of working with INGOs and/or LNGOs, and retired persons of government departments with extensive networks and financial management skills. The diversity and strong professional competences of staff has helped MDCG to gain momentum and to transition from a low profile CBO to a full profile NGO.While saving lives and alleviating immediate suffering are first priority of MDCG intervention, MDCG recognizes the urgent need for more advanced and sustainable development in remote villages, especially in ethnic minority areas that have been neglected for so many decades. So, to achieve highest impact of recovery, MDCG aims to accompany all relief efforts with livelihoods and infrastructure rehabilitation in integrated fashion. MDCG staff is dedicated to help people in these remote areas and challenging environments and therefore are principally based in the field. Similar to CBOs, MDCG field staff work through community networks (women’s associations, volunteer groups, VDC, etc) to strengthen their capacity and community ownership of the project. Community participation and contribution play an integral element in MDCG conception and implementation of projects.","Yadanar Myaing Street, Kamayut Township, Yangon, Yangon, Myanmar"
1,Youth Pacemaker Organization,Participation in Good Governance,"Mandalay Region, Myanmar (Burma)"
2,Helping Hands Myanmar,"Helping Hands Organization has experiences of training on enhancing capacity of community leaders’ democracy and human rights with the support of Paung Ku in 2012. In 2013, Helping Hands organization received People In Need (PIN)’s fund to provide Civic Education and Political awareness trainings and organize workshop and community level platform for 10 times. In resulting of strong participation and coordination of community leaders and strong networking, community based organizations (CSOs) as such Mwe Taung local development group and Nan Lui Kual local development organizations come out. Currently, Myay Taung Local development group are taking a leading role on land issues of Mwe Taung Red Copper project and Chin State and Sagaing Boundary problems. Then, Nan Lwe Kwel local development group are involving and coordinating with Helping Hands in the local development activities. In 2014, Helping Hands organized conference on democracy talk with the support of Dana Shae Saung Myanmar from Yangon, 88 generation (Kalay) and upper Chindwin youth network and the participants from different stakeholders included township and Regional level political leaders, government departments and civil society. HHO organized women conference and meeting for land issue/confiscation. From 2014 March to 2015, in partnership with FSWG, the project of multi-agriculture and livestock breeding was implemented by LIFT support. For Women Empowerment, HHO give Microfinance to the Home Shop owners and Women handmade, weaver. Women Weaving Group is begin in 2013, and Helping Hands Credit Union is form in 2014 then, there is about 300 members, 98% is women.","Helping Hands office, Kalay, Chin State, Myanmar (Burma)"
3,Stiftunglife,"Die Stiftunglife ist eine 1989 gegründete deutsche gemeinnützige Stiftung, die am besten für ihre Unterstützung der Tafeln zur Ausgabe von Lebensmitteln an Bedürftige bekannt ist. Sie verfolgt jedoch den Grundsatz, dass ihre Mittel je zur Hälfte in Deutschland für die Tafeln und benachbarte Tätigkeiten und zur anderen Hälfte im Ausland eingesetzt werden. Der Schwerpunkt in Myanmar liegt in der Förderung Studenten, denen ein Studium ermöglicht wird, im Bau von Schulen und im Betrieb der Swimming Doctors, die die medizinische Versorgung im Delta verbessern. Die Wasserqualität an den inzwischen über 50 Schulen wird durch PAUL, einem Wasserfilter, verbessert. In Dörfern ohne Elektrizität werden die Kerosinlampen durch sauberes Solarlicht ersetzt und in Bagan wird gerade eine Plastikrecyclingfabrik gebaut.","Yangon, Yangon Region, Myanmar (Burma)"
4,Yello generation wave,We are providing children all over the country and providing education aid.,89MILE 5FALLON YANGON MANDALAY HIGHWAY ROAD
5,Brainworks-Total International School Yangon,"Brainworks-Total Group of schools are located in the Southeast Asian country of Myanmar. In the Ten years since our founding, Brainworks-Total Group of Schools has expanded to 11 branches with over 2500 very motivated students, and 400 dedicated teachers","41, Myanmar (Burma)"
6,Australia-Asia Program to Combat Trafficking in Persons,"The Australia-Asia Program to Combat Trafficking in Persons (AAPTIP: 2013-18) builds on the success of ARCPPT and ARTIP. AAPTIP will operate at both regional and national levels. It will provide support to the Association of South East Asian Nations (ASEAN), working with the ASEAN Secretariat (ASEC), regional anti-human trafficking bodies and individual partner countries.Human trafficking is the illegal trading of human beings for the purpose of labour, sexual and other forms of exploitation. It is a crime that can occur within a country or across national borders. Trafficking contravenes fundamental human rights, denying basic and broadly accepted individual freedoms to women, men and children all over the world. It has wide economic, social and political impacts, and has serious consequences for development in South East Asia.Diverse but integrated responses are needed to effectively combat human trafficking through prevention, prosecution and protection. Since 2003, Australia has invested more than $50 million across these three approaches. Australia is one of the few donors to support the criminal justice response to human trafficking through the Asia Regional Cooperation to Prevent People Trafficking (ARCPPT: 2003-6) and the Asia Regional Trafficking in Persons Project (ARTIP: 2006-12).AAPTIP GOALTo reduce the incentives and opportunities for the trafficking of persons in the ASEAN region.AAPTIP OBJECTIVESAssistance will be provided to regional and national stakeholders to achieve the following outcomes:– Law enforcement agencies improve the effective and ethical investigation of human trafficking cases;– Prosecutors improve the effective and ethical prosecution of human trafficking cases;– Judges and court officials improve the fair and timely adjudication of human trafficking cases;– Regional bodies enhance regional cooperation and leadership on the criminal justice response to human trafficking in the ASEAN region.Working through existing local planning and delivery mechanisms, AAPTIP will support the development and implementation of work plans by counterparts at two levels:national, by supporting annual plans developed by each national program steering committee;regional, by supporting the ASEAN Secretariat, the ASEAN Trafficking in Persons Working Group of the Senior Officers Meeting on Transnational Crime (SOMTC TIP WG), and the Heads of Specialist Unit (HSU) processSTAFFING & SUPPORTAAPTIP is managed by AAPTIP DFATs Asia Regional Programs office in Thailand.Cardno Emerging Markets, the Implementation Service Provider, is based in Thailand, with national country program coordinators and national monitoring and evaluation officers in Cambodia, Indonesia, Lao PDR, Myanmar, Philippines, Thailand and Vietnam.AAPTIP will provide high quality technical advice and support through a team of internationally experienced and qualified specialists.DFATs East Asia Regional has appointed a Partnership and Advocacy Manager, based in Thailand, to drive Australia strategic dialogue on trafficking with key stakeholders.","No. 100, Kan Kaw Myaing Road, Parami, Yankin Township, Yangon, Myanmar"
7,Agency for Education of the Poor Rural Youth,Agency for Education of the Poor Rural Youth (AEPRY) is a temporary registered non-government organization in Myanmar. AEPRY mainly focus on sustainable rural development and job oriented education.,"Yangon, Yangon Region, Myanmar (Burma)"
8,"Zomi Innkuan USA, Inc.","Zomi Innkuan USA is incorporated in the State of Oklahoma andexempt from Federal Income Tax as a Public Charity of Section 501(c) 3,with EIN # 26-4145898.Zomi Innkuan USA, Inc. is in Consultative Status withUnited Nations Economic and Social Council since July 2014.","7438 S. 95th East Ave. Tulsa, OK 74133, USA"
9,International Schools in Yangon,Providing best educational services in Yangon Myanmar,"Brainworks-Total K-12 Integrated School, 1 Thumingalar Street, 16/4 Quarter, Thingangyun, Yangon, Union of Myanmar"
10,Myanmar Orphans Support Network,"This network is founded by youth people who live in Myanmar (Burma). We are supporting orphans and poor child from our country. We will also do others motivation activities for orphans. You are welcome to join our group and help the children.Our VisionSupporting the vulnerable children, including orphans for building the sustainable development of the country.Our MissionTo help and support the orphans in terms of education, health care, nutrition and other social welfare.","255 Aung Thit Sar Street, Yangon, Yangon Region, Republic of the Union of Myanmar"
11,Myanmar Youth Network,"Youth-led civil society organization for youth mobilization and advocacy to initiate strong civil society and voice the Myanmar youth concerns in the international community.Vision:Educating and instilling young people in modern thoughts to work towards the welfare of the world by contributing peace, justice, harmony and loving kindness.Mission:Young people with sincerity, cooperation, cohesion and perseverance shall create a peaceful, harmonious and beautiful world.Objectives:The general objectives stated in the legal basis of the Myanmar Youth Network are to:Promote tolerance and mutual understanding among young people.Foster candid cooperation habit among young people.Encourage young people to energetically participate in social works.Train and develop young people in becoming effective leaders in our society.Educate young people to keep abreast of the world.","Yangon, Yangon Region, Republic of the Union of Myanmar"
12,Pandita Development Institute (PDI),"Pandita Development Institute (PDI) is a civil society organization, which is to promote the citizen participation and practice democratic principles in the society.MissionTo build a democratic nation in which sustainable development is embedded by the active citizens and mission is community leaders with sincerity, collaboration, perseverance and cohesion shall create the peaceful, harmonious and democratic country.","93, Seikkanthar Street, Kyauktada, Yangon, Yangon Region"
13,Karen Women Organisation (KWO),"To assist women in the endeavour to be free from all forms of oppression.To promote and empower women in all spheres of life, including education and general living standards.To encourage women to participate in the struggle for freedom, democracy and equality.To develop women’s knowledge, ability and skills, including political and organisational skills.To achieve the rights of women and equal status with men.To promote and maintain Karen culture and traditions.To improve the well being of women and children and to increase their access to adequate health, education and welfare service","P.O. Box 19, Mae Sariang, Mae Hong Song Province 58110, Thailand"
14,Karenni National Women's Organization,"To empower Karenni women to play a leadership roleTo organize education, income generation and other projects for the benefit of the entire Karenni refugee populationTo increase international awareness of the Karenni situationTo promote gender equality and fight all forms of discriminationTo preserve the customs, literature and languages of the Karenni peopleTo promote and advocate for women and child rightsTo take care of women who are affected by violence","P.O. Box 31 , Mae Hong Son 58000, Thailand"
15,Palaung Women's Organization,"We are Palaung women who will advocate and advance the statues of women in field of development and working forwards achieving gender equality, justice, peace and democratic society.","P.O. Box 98 Mae Sot, Tak 63110, Thailand"
16,Kachin Women's Association Thailand,The empowerment and advancement of Kachin women in order to improve the lives of women and children in Kachin society.,"PO Box 415, Chiang Mai, Thailand, 50000"
17,Shan Human Rights Foundation,"To strive for human rights and restore justice to the victims;To promote democracy in accordance with the desire and will of the people, and establish a popular government based on democratic principles;To strive for unity, fraternity, equality and cooperation;To strive for world peace, freedom and prosperity.","Prasingh P.O., 50205 Chiang Mai, Thailand"
18,Free Burma Rangers,"The Free Burma Rangers (FBR) is a multi-ethnic humanitarian service movement. They bring help, hope and love to people in the war zones of Burma.","P.O. Box 14, Mae Jo, Chiang Mai, 50290, Thailand"
19,The Border Consortium (TBC),"TBC is a consortium of 10 international non-governmental organisations (NGOs) from eight countries. TBC’s main focus is to provide food, shelter and capacity-building support to Burmese refugees and displaced persons. The refugee camps are the key locations for current activities, where TBC also provides support for camp management through the refugee committees. TBC also conducts research into the ongoing causes of internal displacement in South East Burma.",12/5 Convent Alley Bang Rak Bangkok 10500 Thailand
20,Helping Hands Organization,To get Equal Right and Equal Opportunity in Myanmar.,"12/6 Taungzalatt, Tahan, Kalay Myo, Sagaing/ Chin State"
21,Wathann Film Institute (WFI),Organizer of the Wathann Film Festival – the very first film festival in Myanmar.,"15(3B), Obo street (Near Yay kyaw, Shwe Pone Pwint Pagoda) Pazundaung Twonship, Yangon, Myanmar"
22,MIDO (Myanmar ICT for Development Organization),"Conducting ICT trainings to people across all regions in Myanmar.Organizing seminars and workshops on contemporary ICT technologiesProtecting individual rights of users and sharing ICT knowledge on digital security and privacy.Research and development of laws and policy which safeguard individual users, businesses and entreprenuers. Publishing reports, and collaborating with respective groups and organizations.","No. 20, 2nd Floor, Htee Tan 1st Street, Kyee Myin Dine, Yangon, Burma"
23,Alternative Asean Network on Burma (ALTSEAN),"ALTSEAN-Burma (Alternative ASEAN Network on Burma) is a network of organizations and individuals based in ASEAN member states working to support the movement for human rights and democracy in Burma. The network is comprised of human rights & social justice NGOs, political parties, think tanks, academics, journalists and student activists.","PO BOX 296 - Lardprao Post Office, 10310 Bangkok, Thailand"
24,Women's Rights and Welfare Association of Burma,"The Women’s Rights and Welfare Association of Burma (WRWAB) was founded in February 1995 by a group of Burmese women in Delhi. The organization has set up training workshops on women’s rights and health care and encouraged women’s participation in decision making and political mobilization.The WRWAB established a healthcare centre for Burmese migrants in Delhi to provide primary health care and medicines free of cost, as well as to practice minor operations and deliver babies. A certified, experienced nurse from Burma provides treatment. The centre also organizes workshops on health education.","Vikas Puri, New Delhi, Delhi, India"
25,Burma Charity Fund,The Burmese Charity Fund was founded by three Burmese members in 2005. The general purpose of the organization is to help Burmese refugees in Delhi to meet their basic livelihood needs and get access to health care through small cash support. The fund also provides financial assistance to students in need.,"West Delhi, Delhi, India"
26,Chin Human Rights Organization (Delhi),"Chin Human Rights organization (CHRO) is a non-governmental non-profit organization legally registered in Canada with branch offices in India, Thailand and in the United States.Formed in 1995 by a group of Chin activists who began monitoring human rights situation in Chin State and Western Burma along the borders with India and Bangladesh, the CHRO has grown from a small organization to a well-respected and professionally managed human rights organization. The organization aims to promote and protect the rights of Chin people by educating and empowering them through training/workshops and also through advocacy work. The population served includes Chin in Chin state, Burma, as well as Chin refugees living in such countries as India and Malaysia.","West Delhi, Delhi, India"
27,HIV/AIDS Prevention and Care Centre,The HIV/AIDS Prevention and Care Centre was founded in 2002 to provide guidance and training about HIV/AIDS. The aim of the organization is to eliminate HIV/AIDS from Burma. Current activities include operation of a community centre to provide basic shelter and medical treatment to HIV/AIDS patients as well as activities to assist with reintegration of HIV/AIDS patients to the society. The organization is fully dependent on individual donations.,"Yangon, Yangon Region, Myanmar"
28,Burmese Social Welfare Association,"The Burmese Social Welfare Association was established in May 2005 by Burmese migrant workers in Mizoram state of India. BSWA is comprised of 17 committee members and 3 advisors and among the committee members 3 seats are for female activists. BSWA seeks to provide medical, educational and funeral services for the Burmese migrant workers in Mizoram state, one of the regions highly populated with Burmese migrant workers.","Aizawl, Mizoram, India"
29,The Matu Herald News Group,The Matu Herald News Group was established in October 2008. The group seeks to inform all Burmese living outside the country (specifically those from the Matu community living in India) about the political situation inside Burma. The group members also see publishing the journal as a means of non-violent political movement to improve the government of Burma.,"Sitapuri, New Delhi"
30,Burmese Women Delhi,"Burmese Women Delhi was founded in 2006 by 25 women from different communities in Delhi. The organization’s objectives are 1) to reduce violence against women, 2) empower Burmese refugee women in Delhi and 3) link with Indian NGOs and women groups. Main activities include training, a monthly women’s exchange, efforts to bring an end to violence against women, and networking with other organizations.","New Delhi, India"
31,Social Health and Education Development (SHED),"Social Health and Education Development (SHED) was formed in June 2010 for village health education and to provide limited primary health care to the medically under-served population of Indo-Burma border area. Since 2012, SHED has been concentrating on reaching out to the Burmese refugees in the region to provide health education. The organization aims to raise awareness in health-related issues and also to train medical personnel to be able to provide logistical support for emergency patients such as first-aid services or referring them to bigger medical facilities.","Mizoram, India"
32,Zomi Community Delhi,"Zomi Community Delhi is a social organization started in 2002 by people from the Zomi ethnic group originating in the Chin State of Burma. The main purpose of the organization is to help fellow Zomi, build unity among the community, integrate with local people, solve problems with others, translate/interpret in different languages, lead/guide newcomers to achieve their goals and promote education.","Vikas Puri, West Delhi"
33,The Heritage of Mon Culture Group,"The Heritage of Mon Culture Group was established in 2003 with its aim to perpetuate and conserve the Mon traditional and cultural heritage throughout the world. Since the establishment, the organization has strived to introduce the Mon culture to the public. The Heritage of Mon Culture Group has produced 30 items of Mon traditional songs and dances with voluntary contributions from its members and supporters. The organization has opened training session of the Mon traditional dance and music in the USA and in Thailand for anyone who is interested.","Moulmein, Burma"
34,Health Education Awareness Raising Team (HEART),"Founded in 2013 by a group of medical experts to promote activities related to public health education, HEART aims to raise awareness and prevent public health problems such as HIV/AIDS, Malaria and Tuberculosis. The publications of HEART mainly put its emphasis on preventive care and healthy living.","Moulmein, Mon, Burma"
35,Chin Human Rights Organization (Aizawl),"Chin Human Rights organization (CHRO) is a non-governmental non-profit organization legally registered in Canada with branch offices in India, Thailand and in the United States.Formed in 1995 by a group of Chin activists who began monitoring human rights situation in the Chin State and in Western Burma along the borders with India and Bangladesh, the CHRO has grown from a small organization to a well-respected and professionally managed human rights organization. The organization aims to promote and protect the rights of Chin people by educating and empowering them through training/workshops and also through advocacy work. The population served includes Chin in the Chin state, Burma, as well as Chin refugees living in India and Malaysia.","Aizawl, Mizoram, India"
36,Mizo Welfare Organization,"Mizo Welfare Organization (MWO) was founded in October, 2007 to support the welfare of the Burmese people, promote and protect their culture, improve awareness of human rights and democracy, and unify people living in the Kabaw Valley in Burma as well as community members living in Mizoram. MWO seeks to instill democratic values in Burmese refugees through capacity building and thus to promote democratic transition in Burma. The organization aims to further support women and youth in particular, and to help develop the community as a whole.","Aizawl, Mizoram"
37,Chin Student Union (CSU),"The Chin Student Union was formed in 1946, by a few Chin students at the Rangoon University, to participate in the movement to achieve independence from the British Empire. After the student uprising in Burma on August 8, 1988, leaders were exiled to India and the organization was reformed in 1995. The Chin Student Union’s aims and objectives include helping with the educational and social problems of the Chin people; preserving and promoting the Chin literature, culture, and tradition; and advocating for equality and self-determination in the Union of Burma together with other ethnic organizations.The CSU helps Burmese students and youth to get admission to Indian schools, colleges, and universities. It has organized workshops, trainings, and other activities for Burmese refugees in Delhi. CSC has also collaborated with Tibetan Student Union and Indian Student Union to help Burmese people get access to education in India. The organization serves Burmese refugees all over India and networks with student groups inside as well as outside of Burma.","New Delhi, Delhi, India"
38,Chin Refugee Committee,"Chin Refugee Committee Delhi was established in January 1996 by the Chin people who had fled from persecution in Burma. Since then, CRC has worked to address the problems Chin refugees and asylum seekers face in India.CRC is a community based organization run by 22 members, each representing the different Chin communities of Delhi. The organization aims to look into the affairs of the Chin community and provide relief and assistance in regards to health, education and development of the Chin refugees in Delhi.CRC also endeavors to bring international attention to the situation of the Chin refugees as well as advocating with the UNHCR for legal and financial assistance for refugees.","West Delhi, Delhi, India"
39,Zomi Women Union,The aims and activities of the organization are promoting the education and rights of women and children.,"West Delhi, Delhi, India"
40,Delhi Burmese Christian Fellowship,–,"Janakpuri, New Delhi, Delhi, India"
41,Radanar Ayar Rural Development Association,"Poverty reduction by offering an enabling environment to all stakeholders through improved governance and environmentally feasible for the right-livelihood interventions and Partnership building at all levels will supplement and ensure the goal of sustainable development which is socially, environmentally, politically and legally feasible missions of emergency and development conditions.","Bogale, Ayeyarwady, Myanmar"
