,organisation,description,address
42,Kuki Women's Human Rights Organization (Burma) (KWHRO),"Mission: to work for women empowerment, to work for increased participation of women in politics & peace reconciliation process in Burmareproductive training,peace training & awareness program,women against violence program (discussion)political awareness & discussion,field work (inside Burma)","Ward No. 2, Moreh, Chandel District, Manipur, India"
43,BusinessKind Myanmar,"BusinessKind-Myanmar (BK-M) is a small non-profit NGO based in Yangon, Myanmar. Its mission is to develop small community based neutral profit businesses that produce affordable products that improve the daily living conditions of poor people. BKM is operating by women for women.Factory Address#A1, Hti Hlaing Shin Housing, Kyan-sit-thar Road,Hlaing Tharyar Township, Yangon, Myanmar.Tel: 09- 7321 4887, 09- 8 624 625, 09- 500 40 60","Dr. Helen Gunthorpe, International Director, Room - 37, Building 1, 4 Floor, Civil Development Building (North) 8 mile junction, Corner of Pyay Rd. and Kabaraye Pagoda Rd., Mayangone Township, Yangon, Myanmar"
44,Karuna Myanmar Social Services (KMSS),To serve the poor and the needy by motivating and empowering them towards quality and dignity of life based on the social teachings of the Church.,"No.292(A), Pyay Road, Sanchaung Township, Yangon"
45,Austrian Burma Center,Human RightsRefugee SupportDevelopment Assistance,"Vienna, Austria"
46,Burma Aktion,"It is our aim to inform the general public, media and the German government about the true situation in Burma. To understand the present-day situation and problems it is essential to know about Burma’s history.It is our clear aim to struggle for a real democracy, equality of all ethnic people, an end of racism, human-rights discrimination and the civil-wars against the ethnic minorities. We are the voice of the people in Burma and share our solidarity with them. Therefore, our efforts are for the people according to their wishes, dreams and desires.We help these ideas to get a voice that is heard by the general public and the media and that the German government will listen to this voice to use their influence for a fundamental change in Burma.","Essen, Germany"
47,Swanyee Development Foundation,"Assist in crisis or chronic distress, and work toward the development of long term solutions on the basis of community participation.Assist communities, especially poor and vulnerable, by providing infrastructures and capacity enhancing activities addressing basic needs, and other assistance necessary to achieve self-reliance in their lives.Advocate for and assist communities in their management of natural resources effectively and efficiently, and climate change adaption.Promote gender equity and provide equitable assistance to the communities to ensure development of target population in the working area for improving their livelihoods without any form of discrimination.Develop long-term partnership with key stakeholders, where all partners are on equal terms, to achieve sustainable development in communities.","Bahan, Yangon, Yangon Region, Myanmar"
48,Burma Border Projects,"Burma Border Projects (BBP) is a non-profit organization dedicated to the mental health and psychosocial well-being of the displaced people from Burma. Our programs address the psychosocial consequences of the trauma associated with human rights abuses and dislocation of Burmese refugees.We are the only organization on the Thai-Burma border whose primary mission is to provide mental health resources, training, and support to strengthen the skills of local community-based organizations and individuals. Since 2008, BBP has also supported the efforts of community based organizations to improve the reproductive health of adolescents and adults on both sides of the Thai-Burma border. We work in culturally-appropriate and collaborative ways in order to empower communities.",Mae Sot District Tak Thailand
49,Assistance Association for Political Prisoners (Burma),"The Assistance Association for Political Prisoners (AAPP) is a human rights organization based in Mae Sot, Thailand that works for the release of all political prisoners and for the improvement of prison conditions inside Burma.","PO Box 93, Mae Sot, Tak Province, 63110 Thailand"
50,Burma Center Prague,"The mission of BCP is to contribute to the democratization of Burma and the respect for human rights. It seeks to improve the lives of people in Burma and Burmese in exileby analyzing the situation in Burma and by informing and involving the European public;by serving as a bridge between Europe and Burma;by providing needed services for Burmese, in particular capacity building and facilitating the integration of refugees; andby supporting the empowerment and active participation of Burmese for the transition of BurmaOur activities emphasize the importance of human rights and the necessity to provide the population with basic tools enabling it to survive and to receive fundamental goods, such as education, health care and legal security. Also it is assumed that genuine democracy and the respect for human rights are preconditions for development and equal distribution of wealth in Burma. We act in accordance with the Universal Declaration of Human Rights of the United Nations and the UN Millennium Development Goals.","Dělnická 54, Prague, Czech Republic"
