,name,type,rank,description
41,Patrick Manasse,person,80270.0,"Patrick Manasse is the Founder and Chief Compliance Officer for MonetaGo Financial Technology company which leverages blockchain and other technologies to create networks for Financial Institutions. Having lived in nearly every corner of the globe, Patrick now calls New York City home. Prior to working with MonetaGo, Manasse pursued a number of initiatives that combined his interests in both business and law. At McGill Univeristy, Manasse received a B.A. in Economics. He then took an internship at Lazard Investment Bank in Paris. Although offered a position to stay on, he decided to more actively pursue his interest in law. He enrolled at the University of Bond, Australia, where he earned his JD. An agreement between Bond University and and the American Bar Association allowed Manasse to take the bar in either New York or Los Angeles upon his graduation.  After being offered an opportunity to work with the much lauded Spitfire Pictures, Manasse decided to move to LA. During his time with Spitfire, Manasse worked closely with Guy East and Nigel Sinclair. He assisted the company in the production of a number of films including Martin Scorcese's ''No Direction Home'', which won an Emmy Award, two Grammy Awards, and a Peabody Award. Having gathered ample work experience under the purview of East and Sinclar, Manasse then moved to New York City where he worked as a paralegal while also preparing to take the New York Bar. His work as a paralegal lead him to a position as an associate with the international law firm Guzov Ofsink. There he worked for both the Corporate and Commercial Litigation groups."
42,Harsh Samasraj,person,696649.0,Founder at Hymnn Music.
43,Daniel Riazzoli,person,253822.0,"Eight years' investment experience, most recently as Senior Associate at FSN Capital Partners and prior to that as Associate at 3i Nordic. Also three years as a management consultant with McKinsey & Co."
44,Thuc Tran,person,329266.0,"Thuc Tran is a Ph.D. candidate in systems engineering at George Washington University, having previously completed his M.S. in computer science at Georgia Tech. He also has an M.S. in systems engineering from George Washington University, and a B.S. in information technology from George Mason University. His previous work includes recommendation systems and micro service-oriented web technologies at Gannett / USA Today Network."
45,Kinnar Solanki,person,792507.0,Founder of Ducktile.
46,Guzman Diaz,person,35642.0,"Guzman focuses on venture investments in gaming, media and entertainment. He is particularly interested in businesses that enable people to interact with others through content. Prior to Index, Guzman worked at on-demand taxi service Hailo until its merger with mytaxi. He also worked at Korean interest-based social network Vingle and at mobile game developer Social Point. Guzman graduated with a degree in Economics from Universitat Pompeu Fabra. He currently lives in London and regularly spends time in San Francisco and New York."
47,David Hale,person,512037.0,"David is a lead advisor to Avondale’s San Francisco Bay Area wealth management clients. He also focuses broadly on growth for Avondale’s wealth and asset management divisions on the West coast. Bringing more than 15 years of wealth management experience to the firm, David’s background and expertise center on helping affluent and high net worth individuals make asset allocation, portfolio management and financial planning decisions.   Prior to joining Avondale in 2012, David was the sole Managing Principal of DNH Capital, LLC, a boutique wealth and asset management firm in San Francisco where he handled all marketing and relationship management duties and spearheaded asset allocation and portfolio management decisions.  David, based in Avondale’s San Francisco office, is a graduate of Loyala University in Chicago where he earned a BS in both Finance and Marketing and a minor in French Literature. He is currently studying at University of California at Berkeley Extension to obtain a Certificate in Personal Financial Planning. In his spare time, he enjoys distance running, snowboarding, and spending time with his wife Casey and their three young children."
48,Ryan Brown,person,353952.0,"As a Portfolio Manager on the equity team, Ryan Brown is responsible for the day-to-day portfolio management and trading for U.S. equity-based investment strategies. Ryan also contributes to the ongoing research efforts of these strategies. Prior to joining Analytic, Ryan worked for Beekman Capital Management, in Santa Fe, New Mexico, where he was responsible for selecting stocks within the financial services sector. Ryan received a B.S. in Economics at Brigham Young University and an M.S. in Finance at the University of Utah."
49,Claus Schmiedel,person,850587.0,"Claus Schmiedel was born in 8 March 1951 in Ludwigsburg, protestant. He is a member of the SPD since 1972. 1975-1991 City Council in Marbach. 1985 to 1994 and from 2009 a member of the County Council in Ludwigsburg. 1994-2008 Chairman of the SPD fraction of the Verband Region Stuttgart. Since 2010 member of the Regional Assembly of the Verband Region Stuttgart. Member of the Landtag of Baden-Württemberg since 24 April 1992. Since 2008 Chairman of the SPD parliamentary group.   "
