,language,type,name,origin
212,English,detail,Rosetta,"Anyway, there's something about her I can't quite put my finger on. So stay sharp around these monsters and around <span class='scene-font-italic'>her</span>."
213,English,synopsis,,"Furias offers a truce, saying the price of fighting the crew is too high for the empire to pay. [플레이어] and the crew aren't sure what to make of the offer, so Vira suggests they sleep on it."
214,English,detail,,silent
215,English,detail,,Vira leads [플레이어] and the crew into the state room of Albion Castle.
216,English,detail,,"Furias awaits them, flanked by more than a few soldiers."
217,English,detail,Furias,"I've given up, I say! I've thrown in the towel!"
218,English,detail,Furias,"You're so much stronger than we expected, and it's just doesn't pay to keep up the fight."
219,English,detail,Katalina,To keep up the fight?
220,English,detail,Furias,Exactly! Don't forget that little Miss Top Secret over there still has a few secrets we don't know.
221,English,detail,Furias,Getting her back and figuring her out will cost us more than she's worth.
222,English,detail,Furias,We'd do better to spend our resources elsewhere which would profit the empire as a whole.
223,English,detail,,Furias is in high spirits as he leaps to his feet.
224,English,detail,Furias,So there you have it! You're all free as a bird!
225,English,detail,Furias,Take your little airship and fly wherever you please.
226,English,detail,Furias,"So long! Let's have a nice, hot cup of tea next time we meet."
227,English,detail,,[플레이어] and the crew are quickly escorted out of the room without so much as a chance to speak.
228,English,detail,Vyrn,Hold on a sec... I still don't understand what happened back there.
229,English,detail,Rackam,We gave him all that trouble and now he's backing down?
230,English,detail,Vira,Just think it over. I'll show you to your rooms and you can sleep on it. How does that sound?
231,English,detail,Vira,"Besides, I just happen to know where you can find some vacant rooms!"
232,English,detail,Vyrn,"Sounds great! What do you say, [플레이어]? We deserve a nice break!"
233,English,detail,Rackam,"I'll say! Show us the way, Vira!"
234,English,synopsis,,"[플레이어] and the crew have trouble trusting the offer from the empire. Katalina seems worried, but Vira assures her that she's in good hands."
235,English,detail,Katalina,Is this it? Is it really all over now?
236,English,detail,Rosetta,You don't trust the mini major will keep his word? Not that your instincts are wrong...
237,English,detail,Eugen,They're our enemies no matter how you slice it. Trust is out of the question.
238,English,detail,Katalina,I can't help be feel that something's off about this. Like this isn't the end...
239,English,detail,Vira,"Don't be silly, Katalina!"
240,English,detail,Katalina,Vira...
241,English,detail,Vira,I've heard tales of all your travels that eventually led you here.
242,English,detail,Vira,You poor thing... Surely you're exhausted from fighting day after day.
243,English,detail,Vira,But there's nothing at all for you to worry about here. Just let me take care of everything!
244,English,detail,Eugen,Ha-ha! I bet you were the teacher's pet 'cause you're so helpful!
245,English,detail,Vira,Thank you.
246,English,detail,Monster,Groooar!
247,English,detail,Vira,"Your rooms are right ahead, but we have a few monsters to take care of."
248,English,detail,Vira,"Just a little longer until you can rest easy, [플레이어]!"
249,English,synopsis,,"[플레이어] and the crew find Sierokarte managing the guest rooms in Albion Castle. After a good night's rest, they awake to find Katalina gone and a farewell letter in her place."
250,English,detail,Sierokarte,"Welcome, welcome to the Albion branch of the KnickKnack Shack!"
251,English,detail,Rackam,What're you doing here! I could've sworn this was a bedroom!
252,English,detail,Sierokarte,Remember! I am both everywhere and nowhere!
253,English,detail,Vira,We're having her manage the vacancies. She's quite the reliable one.
254,English,detail,Sierokarte,"I've heard all about your troubles! You guys make sure to take it nice and easy here, okay?"
255,English,detail,,[플레이어] and the crew spend a quiet night in Albion Castle.
256,English,detail,,"But the next morning, they find Katalina gone with only a short farewell letter left behind."
