,language,type,name,origin
221,English,detail,Katalina,"You said you're here on an errand, correct?"
222,English,detail,Katalina,"Could you tell us what it is? I mean, as long as it's all right to share."
223,English,detail,Rosetta,"Oh, about my errand? It's an important question to ask. And it shows you're being cautious..."
224,English,detail,Katalina,Well then?
225,English,detail,Rosetta,"No, no! I cannot say. Do I need to repeat myself? A woman must have her mysteries!"
226,English,detail,Rackam,What's the hold up back here? Io and the others are about to leave you two behind!
227,English,detail,Rosetta,"Now then, shall we go? We wouldn't want to get lost in a place like this!"
228,English,synopsis,,"Katalina talks privately with [플레이어] about Rosetta's mysterious behavior. Still unsure of her motive, they decide to proceed with caution."
229,English,detail,,Katalina motions for [플레이어] to come near and begins to speak in a hushed voice.
230,English,detail,Katalina,"[플레이어], did you see what I saw? About Rosetta..."
231,English,detail,Katalina,"When we first met, the monsters kept their distance from her. As if bowing at her feet..."
232,English,detail,Katalina,"On top of that, she hid herself cleverly enough to surprise us. So what's your take on all this?"
233,English,sel1_txt,,The monsters were crouching to attack her!
234,English,sel2_txt,,"Well, she <span class='scene-font-italic'>is</span> a charmer..."
235,English,detail,Katalina,I suppose that makes sense... I still get the feeling there's something not right about her though.
236,English,detail,Katalina,"But if that's true, then who is she? And what does she want?"
237,English,detail,Katalina,"I guess you're as clueless as I am... Whatever the case, I think it's wise to keep an eye on her going forward."
238,English,synopsis,,"Deep in the forest, Rackam sees a sign for the Knickknack Shack. Lyria's powers indicate that the Black Knight may be in the same direction, so [플레이어] and the others set off down the path."
239,English,detail,Rackam,Hm? What's that over there?
240,English,detail,Io,What's the matter? You see something?
241,English,detail,Rackam,If my eyes aren't playing tricks on me... it's a sign for the Knickknack Shack.
242,English,detail,Io,In the middle of the forest?
243,English,detail,Io,"You sure you don't need to get your eyes checked, gramps?"
244,English,detail,Rackam,"Hey! I'm still as spry as a fox, thank you very much!"
245,English,detail,Rackam,"You see it too, right, Vyrn?"
246,English,detail,Vyrn,Hm... There's definitely something over there! Couldn't tell you what it is though.
247,English,detail,Lyria,"Hey, Rackam! Can you point it out to me?"
248,English,detail,Rackam,Hm? It's over there. Beyond those trees.
249,English,detail,Lyria,Over there? I can feel Leviathan resonating with something from that direction.
250,English,detail,Lyria,The Black Knight and the girl she was travelling with might be over there...
251,English,detail,Rackam,The Black Knight paying Siero a visit? That sounds like bad news. Hopefully it's nothing.
252,English,detail,Eugen,This is the Black Knight we're talking about. It's not gonna be nothing.
253,English,detail,Rackam,"Tch... You're right. Let's go, [플레이어]! Onward!"
254,English,synopsis,,[플레이어] and the others rush to the Knickknack Shack where a giant monster has suddenly appeared.
255,English,detail,Monster,Groooar!
256,English,detail,Rackam,What's a huge monster like that doing in front of the shop? Looks like this one's no joke!
257,English,detail,Rosetta,"Oh, how gallant! I must say, I'm quite the fan of this side of you, Rackam."
258,English,detail,Eugen,It doesn't matter how gallant you are if you don't have the strength to pull through when it counts!
259,English,detail,Rosetta,"So true, so true. I'd love to see more though... More of that strength of yours!"
260,English,synopsis,,"[플레이어] and the others arrive at the Knickknack Shack to find the mysterious girl from before quietly eating alone. However, the Black Knight is nowhere to be found."
261,English,detail,,"After defeating the monster, [플레이어] and the others hurry toward the Knickknack Shack."
262,English,detail,Sierokarte,"Welcome, welcome!"
263,English,detail,Sierokarte,"Hm? Well, if it isn't [플레이어] and the crew!"
264,English,detail,Rackam,Wait... Siero? What're you doing on Lumacie!
265,English,detail,Sierokarte,"Because wherever you go, the Knickknack Shack always has your back! You might wanna jot that down!"
266,English,detail,Io,"Weird jokes aside, are you okay? You didn't see any strange folks in black come by, did you?"
267,English,detail,Sierokarte,"I wouldn't call her strange, but a customer's come by who's practically eaten me out of house and home!"
268,English,detail,Sierokarte,But she'll probably get her fill any minute now—
269,English,detail,Rosetta,"Here you go, Siero! You were waiting for this, right?"
270,English,detail,Sierokarte,Oh my! Rosetta! Did [플레이어]'s crew escort you here?
271,English,detail,Katalina,"W-wait just a minute! I mean, what's going on here?"
272,English,detail,Katalina,"Sierokarte and Rosetta know each other, but how exactly?"
273,English,detail,Sierokarte,When you put it that way... that's a real toughie of a question!
274,English,detail,Rosetta,We've known each other for quite a while. I don't think I can sum it up more easily than that.
275,English,detail,Lyria,"But, Siero! You really haven't seen a black knight come through here? With a young girl?"
276,English,detail,Sierokarte,"A black knight, you say? Can't say I've seen one... But if it's a girl you're looking for, take a glance over there!"
277,English,detail,???,"Yum, yum..."
278,English,detail,Lyria,Huh?
279,English,detail,???,...
280,English,detail,???,"Seconds, please..."
281,English,detail,Sierokarte,"Oh, certainly! I'll be back in two shakes of a lamb's tail!"
282,English,detail,,[플레이어] and the crew cross paths with the mysterious girl once more.
283,English,detail,,"But with the Black Knight nowhere to be found, a sense of unease settles over them."
