,language,type,name,origin
214,English,detail,Noa,Another primal beast resides on Golonzo.
215,English,detail,Katalina,Another primal beast?
216,English,detail,Noa,"Yes. One native to this island. I'm more of a stray, so of course it would have more influence on this island than me."
217,English,detail,Noa,"Its name is Mithra, a primal beast who rules over promises. It's actually quite dangerous."
218,English,detail,Noa,"But on the other hand, you could say it's thanks to it that this island was even established."
219,English,detail,Vyrn,So how bad could this thing be?
220,English,detail,Noa,Why don't we continue this conversation at the docks? It will be easier to explain over there.
221,English,synopsis,,Noa tells the crew about the extent of Mithra's powers.
222,English,detail,Ruffian,My very own airship! It's finally ready! Can't wait to get 'er in the air.
223,English,detail,Ruffian,"Ah, here's the fee."
224,English,detail,Shipwright,"Thank you, much obliged. Do come again!"
225,English,detail,Vyrn,So why'd you bring us here?
226,English,detail,Vyrn,Is that primal beast Mithra here or somethin'?
227,English,detail,Lyria,"Uh-uh, I don't get that feeling."
228,English,detail,Noa,Look again. What do you notice?
229,English,detail,Katalina,"Well, it doesn't seem that the people of this island put contracts in writing."
230,English,detail,Katalina,"Even the maintenance fee for the Grandcypher didn't come with an invoice, and that was no small sum."
231,English,detail,Eugen,That's just the way things've been done in Golonzo for decades. Don't think there's anything strange about it.
232,English,detail,Eugen,"Everyone here has a strong sense of responsibility. No one would break a contract, written or unwritten."
233,English,detail,Noa,"And that would be due to the power of Mithra, the primal beast of promises."
234,English,detail,Rackam,What?
235,English,detail,Noa,"It's just as you say, but in reverse. It isn't a sense of responsibility that keeps people from breaking contracts."
236,English,detail,Noa,"Rather they've become responsible, because it's impossible to break a contract on this island."
237,English,detail,Noa,"Mithra's powers work on an unconscious level to keep every contract, pact, or promise absolute and indestructible."
238,English,detail,Noa,This power of promises cannot be escaped by even the most powerful of primal beasts...
239,English,detail,Rackam,So that means Mithra is enforcing our promise?
240,English,detail,Noa,That's right. Even though it was made by a silly little child.
241,English,detail,Noa,"And now, for better or for worse, Mithra's powers are continuing to sustain it."
242,English,detail,Noa,This is why the Grandcypher can't take flight.
243,English,detail,Vyrn,That's crazy... The Grandcypher's really bound by a primal beast's powers!
244,English,detail,Io,"Hey, hey! Can't Lyria do something about this with her powers? Like she did back in Albion?"
245,English,detail,Lyria,Yeah! If I can borrow some of its power and release the—
246,English,detail,Noa,Unfortunately that's impossible. Mithra's power cannot be stopped even by Mithra itself.
247,English,detail,Noa,That is the true depth of its capability.
248,English,detail,Lyria,Wow...
249,English,detail,Monster,Groar!
250,English,detail,Noa,"But I should say there's nothing keeping me from telling you the details of our own promise, save my pride."
251,English,detail,Noa,"I need you to remember them.<br>But first, allow me to help remove this distraction!"
252,English,synopsis,,Freesia appears and demands the crew turn over Lyria.
253,English,detail,Freesia,"Well, well, well. This primal beast—Mithra, was it—seems to have quite a fearsome ability, doesn't it?"
254,English,detail,Vyrn,You again! When did—
255,English,detail,Freesia,"The power to enforce contracts... If used well, it will certainly increase the empire's dominion."
256,English,detail,Freesia,"Claiming it was to come second to recapturing Lyria, but you must reap when a harvest is ready, as they say."
257,English,detail,Katalina,"No, you mean... you've taken it?"
258,English,detail,Freesia,"You're aware of that doll, aren't you?"
259,English,detail,Freesia,So it shouldn't be hard for you to imagine how I did it.
260,English,detail,Eugen,It takes someone real dirty to say such venomous stuff in such a matter-of-fact way.
261,English,detail,Freesia,Now. Return Lyria at once.
262,English,detail,Imperial Soldier,...
263,English,detail,Freesia,"As long as we get Lyria, I don't particularly care how you capture her. Show no mercy to them."
264,English,synopsis,,[플레이어] and the crew break through imperial forces that are blocking their path.
265,English,detail,Katalina,"Tch... If we stay here too long, it's possible they'll overwhelm us."
266,English,detail,Katalina,We've got to make a break for it if we're to have any hope of fulfilling Noa's promise.
267,English,detail,Imperial Soldier,Don't think that you can escape. We've got this whole area sealed off. Not even a mouse could squeeze through us!
268,English,detail,Io,Get out of the way already! We don't have time to dance with you goons!
269,English,detail,Katalina,"They outnumber us... But we're going to break through. Prepare yourself, [플레이어]!"
270,English,synopsis,,"After breaking past the imperial forces, Freesia appears, captures Lyria, and subtly announces that Mithra is under imperial control."
271,English,detail,,"After escaping from the imperial forces, [플레이어] and the crew take a moment to catch their breath."
272,English,detail,Rackam,Huff... Did we give them the slip?
273,English,detail,Katalina,They had the numbers advantage... Huff-huff... But we managed to—
274,English,detail,Freesia,No... My men performed most admirably.
275,English,detail,Freesia,"Thanks to them, we were able to recover Lyria."
276,English,detail,Rackam,What!
277,English,detail,Lyria,Katalina! [플레이어]!
278,English,detail,Katalina,"Lyria! Tch... Damn it, I look away for one second..."
279,English,detail,Imperial Soldier,...
280,English,detail,Katalina,No... No! Get out my way! Move!
281,English,detail,Eugen,There's too many! Get too close and you're a goner!
282,English,detail,Rackam,This woman again! Leave us alone!
283,English,detail,Io,Wait! Where do you think you're taking Lyria?
284,English,detail,Freesia,"Back to the empire where she belongs. Yes, <span class='scene-font-italic'>he</span> will be most pleased with both the girl and Mithra."
285,English,detail,Lyria,"H-help me, [플레이어]!"
286,English,detail,,"The crew desperately reach for Lyria, but it's too late."
287,English,detail,,"Lyria's form grows smaller and smaller as she's taken back to Golonzo's port, where the imperial battleship is waiting."
